Original sent: Ma az iskolában a legtöbb pedagógus arra biztatja a gyermeket , hogy sajátítsa el megfelelõen a tananyagot , de arra nagyon kevesen vezetik rá a gyermeket , hogy ezt hogyan tegye meg úgy , hogy adekvátan beépítse azt a korábbi ismeretei közé , és késõbb használni legyen képes a tudást .
	kwic: és késõbb használni legyen képes
	kwic_new: és késõbb használni legyen képes tudást
Original sent: A látással összehasonlítva a hallás képes elkülöníteni két egymást gyorsan követõ jelet , mivel a szemmel ellentétben nem kell kémiai anyagokat felbontania és újra összeraknia .
	kwic: hallás képes elkülöníteni két egymást
	kwic_new: látással összehasonlítva a hallás képes elkülöníteni két egymást jelet , mivel
Original sent: 2. A halott észleli , hallja és látja a környezetet és halott testét és hallja az ott lévõk gondolatait és imáit , esetleg nagy mesterekkel ebben az állapotban is képes kommunikálni .
	kwic: is képes kommunikálni
	kwic_new: mesterekkel állapotban is képes kommunikálni
Original sent: Elõfordulhat , hogy a dokumentum egyes részeit a régi változatú program nem képes értelmezni , ilyenkor ezeket kihagyja vagy kissé másként jeleníti meg , ám a dokumentumot képes megnyitni .
	kwic: nem képes értelmezni , ilyenkor
	kwic_new: részeit program nem képes értelmezni , ilyenkor kihagyja ám
Original sent: A Sátán ekkor bízta meg alattvalóját , hogy válasszon ki egy csecsemõt , és ruházza fel különleges hatalommal , hogy az majd képes legyen feltörni a 66 pecsét legutolsóját ; megölni a legelsõ démont , Lilith-et .
	kwic: képes legyen feltörni a 66
	kwic_new: majd képes legyen feltörni a 66 legutolsóját ; megölni
Original sent: Noha az egyensúlyérzetre semmi behatással nincsenek , a nagy magasság , valamint a bezártság miatt sokan nem képesek elviselni a rajtuk való utazást .
	kwic: nem képesek elviselni a rajtuk
	kwic_new: miatt sokan nem képesek elviselni a rajtuk utazást
Original sent: Jászvásár ( Le&#x021b;cani ) a legrégebbi adók közé tartozik , Moldva magyar lakta területeit képes ellátni ( román nyelven ) 1053 kHz 400 kW
	kwic: területeit képes ellátni ( román
	kwic_new: Moldva magyar lakta területeit képes ellátni ( román
Original sent: A próbák kimutatták , hogy a gép több mint 644 km/h sebességet képes elérni zuhanórepülésben és akrobatikus teljesítményt produkál .
	kwic: sebességet képes elérni zuhanórepülésben és
	kwic_new: km/h sebességet képes elérni zuhanórepülésben és akrobatikus
Original sent: A folyamatos elõrenyomulásnak és gyõzelmeknek köszönhetõen a japánok igen nagy brit ellátmányt voltak képesek megszerezni , és repülõgépeik a britek üzemanyagával repültek , és az õ bombáikat szórták a visszavonuló hadoszlopokra .
	kwic: voltak képesek megszerezni , és
	kwic_new: köszönhetõen japánok ellátmányt voltak képesek megszerezni , és repülõgépeik
Original sent: A 85 mm-es ágyú 1000 m-es távolságból képes volt átütni 86 mm vastag , 30 fokos dõlésû , homogén hengerelt acélpáncélt .
	kwic: képes volt átütni 86 mm
	kwic_new: távolságból képes volt átütni 86 mm dõlésû
Original sent: Ilyen bõvítések például a folyamat események , támogatja az oldalak közötti lekérdezést , illetve a képes kezelni a bájt folyamot .
	kwic: a képes kezelni a bájt
	kwic_new: lekérdezést a képes kezelni a bájt folyamot
Original sent: A Mobil betonkeverõ modult ( Concrete Mobile Mixer Module ) is képes szállítani ( M1075 CMMM ) .
	kwic: is képes szállítani ( M1075
	kwic_new: modult is képes szállítani ( M1075 CMMM
Original sent: Az elavult , DOS-os vagy 16 bites windowsos programokkal való visszamenõleges kompatibilitás miatt minden hosszú fájlnévhez automatikusan létrehozásra kerül egy 8.3-as fájlnév , amivel a régi programok továbbra is képesek megnyitni , átnevezni , letörölni stb. a fájlt .
	kwic: is képesek megnyitni , átnevezni
	kwic_new: amivel programok továbbra is képesek megnyitni , átnevezni , letörölni
Original sent: Az izraeli hadsereg beszámolója szerint a konfliktus hat napja alatt a gázai-övezetbõl 830 rakétát lõttek ki , ebbõl a Vaskupola védelmi rendszer mindössze 290-et volt képes megsemmisíteni .
	kwic: volt képes megsemmisíteni
	kwic_new: ebbõl rendszer 290-et volt képes megsemmisíteni
Original sent: A nyitány magával rántja az embert , és olyan történet veszi kezdetét , amit egész egyszerûen alig lehet letenni , a sztori pedig nem csak érdekes és izgalmas , de érzelmi szinten is képes hatni a játékosra .
	kwic: is képes hatni a játékosra
	kwic_new: sztori pedig szinten is képes hatni a játékosra
Original sent: Be akarta bebizonyítani , hogy a USS Shenandoah alkalmas tengerészeti felderítésre és képes együttmûködni a felszíni egységekkel .
	kwic: és képes együttmûködni a felszíni
	kwic_new: felderítésre és képes együttmûködni a felszíni egységekkel
Original sent: Mögötte azonban ott van az a szemlélet , amely kirobbanó örömmel képes Jézustól beszélni .
	kwic: képes Jézustól beszélni
	kwic_new: amely örömmel képes Jézustól beszélni
Original sent: Kezdetben volt a hulladékgyûjtõ sziget , és a különgyûjtött hulladékot végül összeöntötték , mert nem volt háttér , hiányzott a feldolgozó kapacitás , aztán lassanként az is alakulgatott , most ott tartunk , hogy ahol gyûjtik , ott általában fel is tudják dolgozni , ám ennek a folyamatnak , komoly költségei vannak , amit a háztartások , a családok nem képesek viselni , de eddig átvállalták helyettük az önkormányzatok .
	kwic: nem képesek viselni , de
	kwic_new: amit nem képesek viselni , de átvállalták
Original sent: Ez jogilag szinte támadhatatlan , de õk képesek támadni és eljutunk a recepción túl úgymond ahhoz az ügyintézõhöz , ahhoz a jogászhoz , aki errõl hajlandó velünk tárgyalni .
	kwic: õk képesek támadni és eljutunk
	kwic_new: õk képesek támadni és eljutunk ügyintézõhöz tárgyalni
Original sent: Az este az emlékezéseké , de jövõbe tekintésünk ritka pillanataival is csak õ képes megajándékozni .
	kwic: õ képes megajándékozni
	kwic_new: este is csak õ képes megajándékozni
Original sent: Egy interjúban Jörg Ditrich Hoppe a Szövetségi Orvosi Kamara elnöke azt mondta - idézem õt - Korábban az állam képes volt biztosítani , hogy még katasztrófahelyzetben sem legyenek túlterhelve sem az orvosok , sem a mûszerek , hogy bármikor lehessen életmentõ , vagy nem is életmentõ mûtéteket elvégezni .
	kwic: képes volt biztosítani , hogy
	kwic_new: Korábban állam képes volt biztosítani , hogy legyenek
Original sent: Egyes elemzõk már most aggódnak , hogy az emberek nem lesznek képesek visszafizetni hiteleiket , mások azt mondják , a hitelválság idén megoldódik , a lakosság pedig elég tartalékkal rendelkezik , hogy fizethesse kölcsöneit .
	kwic: lesznek képesek visszafizetni hiteleiket ,
	kwic_new: emberek nem lesznek képesek visszafizetni hiteleiket , mondják
Original sent: Fõleg a növénytermesztésbõl eredõen , de itt már az állattenyésztéshez is képes magához térni , és valamelyest növelni a kibocsátást .
	kwic: képes magához térni , és
	kwic_new: itt már állattenyésztéshez képes magához térni , és növelni
Original sent: Csiba Katalin szerint a fiatalok nélkül Magyarország nem képes kilábalni a válságból , ezért sokkal nagyobb figyelmet érdemelnek .
	kwic: nem képes kilábalni a válságból
	kwic_new: szerint nélkül Magyarország nem képes kilábalni a válságból , érdemelnek
Original sent: Tölgyessy Péter : - Hát utána bármi bekövetkezhet , mert ez egy lelki helyzet fog elõállni , hogyha valami hasonló eredmény lesz ott , akkor az egyik lehetõség , hogy bekövetkezik a pánik , és egy összeomlásszerû szétesése a kormánynak , illetve a kormánykoalíciónak , ez bekövetkezhet , a szocialisták több esetben igazolták , hogy képesek pánikolni , például a Gyurcsány - Bajnai váltás idején is volt egy-egy perc , ami erre utalt .
	kwic: hogy képesek pánikolni , például
	kwic_new: hogy képesek pánikolni , például Gyurcsány - idején volt
Original sent: Szalay-Berzeviczy Attila , aki 2004-tõl állt a BÉT élén , lépését azzal indokolta , hogy a tõzsde új tulajdonosi szerkezete új helyzetet teremt , most olyan vezetõre van szükség , aki képes megfelelni az osztrák többségi tulajdonosi kör elvárásainak .
	kwic: aki képes megfelelni az osztrák
	kwic_new: aki képes megfelelni az osztrák elvárásainak
Original sent: A vége mindennek az lesz - állítja Norbert Walter , hogy Európa , ahelyett , hogy saját érdekében mélyítené a gazdasági , pénzügyi , és elsõsorban politikai egységesedést , szétesésnek fog indulni és aztán már nem lesz képes helytállni az Ázsiával , az Amerikával folytatott versenyben .
	kwic: lesz képes helytállni az Ázsiával
	kwic_new: aztán már nem lesz képes helytállni az Ázsiával , versenyben
Original sent: Kérdésemre , amelyet a most folyó alkotmányozásról tettem fel , a nagykövet azt felelte : mindenekelõtt fontos tisztázni Magyarország az elmúlt húsz évben feliratkozott a stabil demokráciák táborába , ez pedig lényeges kiindulási pont , az alkotmánnyal kapcsolatban hangsúlyozta , ebben az országban vannak olyan emberek , akik képesek megírni egy jó alkotmányt , amely védi a szabadságjogokat , a véleménynyilvánítás és a sajtószabadságát , a törvények hatalmát .
	kwic: akik képesek megírni egy jó
	kwic_new: akik képesek megírni egy jó alkotmányt
Original sent: Korábban már bebizonyosodott , hogy a vegyület képes emelni felhasználója hangulatát , elõnyösen befolyásolja a viselkedését , sõt akár véglegesen megváltoztathatja - méghozzá kedvezõ irányban - egy ember személyiségét .
	kwic: vegyület képes emelni felhasználója hangulatát
	kwic_new: a vegyület képes emelni felhasználója hangulatát ,
Original sent: Hadd lássa itthon mindenki , hogy ezt a nemzetet csak õ és senki más nem képes egyben tartani .
	kwic: képes egyben tartani
	kwic_new: nemzetet õ más nem képes egyben tartani
Original sent: Amikor megérted kapcsolataid boldogtalanságának okait , és képes vagy Te Lelki érõt ragadni és kilépni abból , legyél büszke magadra - adj Hálát az Istennek , Önmagad Lelkének hogy képes voltál nyitni a boldogság irányába , képes voltál mert erõsebb vagy attól , aki rabságban tartott , a boldogtalanság - a frusztráció rabságában .
	kwic: képes voltál nyitni a boldogság
	kwic_new: Lelkének képes voltál nyitni a boldogság irányába , voltál
Original sent: Néhányan azt állítják , hallották a babákat egymással suttogni , és olyan is van , aki szerint a babák képesek odacsalogatni embereket .
	kwic: babák képesek odacsalogatni embereket
	kwic_new: szerint a babák képesek odacsalogatni embereket
Original sent: A vele csak távolról rokonszenvezõk pedig úgy látják , hogy végre egy " férfi " , aki képes megfékezni az arrogáns Fideszt .
	kwic: aki képes megfékezni az arrogáns
	kwic_new: aki képes megfékezni az arrogáns Fideszt
Original sent: Olyan folyamatokban kell részt vennie , melyek ellenkeznek az elveivel , mégsem képes tiltakozni .
	kwic: mégsem képes tiltakozni
	kwic_new: mégsem képes tiltakozni
Original sent: Olyan folyamatokban kell részt vennie , melyek ellenkeznek az elveivel , mégsem képes tiltakozni .
	kwic: mégsem képes tiltakozni
	kwic_new: mégsem képes tiltakozni
Original sent: Olyan folyamatokban kell részt vennie , melyek ellenkeznek az elveivel , mégsem képes tiltakozni .
	kwic: mégsem képes tiltakozni
	kwic_new: mégsem képes tiltakozni
Original sent: Olyan folyamatokban kell részt vennie , melyek ellenkeznek az elveivel , mégsem képes tiltakozni .
	kwic: mégsem képes tiltakozni
	kwic_new: mégsem képes tiltakozni
Original sent: Olyan folyamatokban kell részt vennie , melyek ellenkeznek az elveivel , mégsem képes tiltakozni .
	kwic: mégsem képes tiltakozni
	kwic_new: mégsem képes tiltakozni
Original sent: Olyan folyamatokban kell részt vennie , melyek ellenkeznek az elveivel , mégsem képes tiltakozni .
	kwic: mégsem képes tiltakozni
	kwic_new: mégsem képes tiltakozni
Original sent: Olyan folyamatokban kell részt vennie , melyek ellenkeznek az elveivel , mégsem képes tiltakozni .
	kwic: mégsem képes tiltakozni
	kwic_new: mégsem képes tiltakozni
Original sent: Olyan folyamatokban kell részt vennie , melyek ellenkeznek az elveivel , mégsem képes tiltakozni .
	kwic: mégsem képes tiltakozni
	kwic_new: mégsem képes tiltakozni
Original sent: Olyan folyamatokban kell részt vennie , melyek ellenkeznek az elveivel , mégsem képes tiltakozni .
	kwic: mégsem képes tiltakozni
	kwic_new: mégsem képes tiltakozni
Original sent: Olyan folyamatokban kell részt vennie , melyek ellenkeznek az elveivel , mégsem képes tiltakozni .
	kwic: mégsem képes tiltakozni
	kwic_new: mégsem képes tiltakozni
Original sent: Olyan folyamatokban kell részt vennie , melyek ellenkeznek az elveivel , mégsem képes tiltakozni .
	kwic: mégsem képes tiltakozni
	kwic_new: mégsem képes tiltakozni
Original sent: Olyan folyamatokban kell részt vennie , melyek ellenkeznek az elveivel , mégsem képes tiltakozni .
	kwic: mégsem képes tiltakozni
	kwic_new: mégsem képes tiltakozni
Original sent: Olyan folyamatokban kell részt vennie , melyek ellenkeznek az elveivel , mégsem képes tiltakozni .
	kwic: mégsem képes tiltakozni
	kwic_new: mégsem képes tiltakozni
Original sent: Olyan folyamatokban kell részt vennie , melyek ellenkeznek az elveivel , mégsem képes tiltakozni .
	kwic: mégsem képes tiltakozni
	kwic_new: mégsem képes tiltakozni
Original sent: Olyan folyamatokban kell részt vennie , melyek ellenkeznek az elveivel , mégsem képes tiltakozni .
	kwic: mégsem képes tiltakozni
	kwic_new: mégsem képes tiltakozni
Original sent: Olyan folyamatokban kell részt vennie , melyek ellenkeznek az elveivel , mégsem képes tiltakozni .
	kwic: mégsem képes tiltakozni
	kwic_new: mégsem képes tiltakozni
Original sent: Olyan folyamatokban kell részt vennie , melyek ellenkeznek az elveivel , mégsem képes tiltakozni .
	kwic: mégsem képes tiltakozni
	kwic_new: mégsem képes tiltakozni
Original sent: Olyan folyamatokban kell részt vennie , melyek ellenkeznek az elveivel , mégsem képes tiltakozni .
	kwic: mégsem képes tiltakozni
	kwic_new: mégsem képes tiltakozni
Original sent: Olyan folyamatokban kell részt vennie , melyek ellenkeznek az elveivel , mégsem képes tiltakozni .
	kwic: mégsem képes tiltakozni
	kwic_new: mégsem képes tiltakozni
Original sent: Olyan folyamatokban kell részt vennie , melyek ellenkeznek az elveivel , mégsem képes tiltakozni .
	kwic: mégsem képes tiltakozni
	kwic_new: mégsem képes tiltakozni
Original sent: Túl könnyelmû a mai napon , ezért nem látja át az összefüggéseket és a következményekkel sem képes számolni .
	kwic: sem képes számolni
	kwic_new: összefüggéseket sem képes számolni
Original sent: Ha minden nap abból táplálkozol , amit õ ad , képes leszel kezelni minden helyzetet , amit az élet hoz .
	kwic: képes leszel kezelni minden helyzetet
	kwic_new: Ha ad képes leszel kezelni minden helyzetet , hoz
Original sent: Hangszerfórum például enélkül és képes életképes maradni .
	kwic: képes életképes maradni
	kwic_new: például enélkül képes életképes maradni
Original sent: Úgy érzi , a mai napon nincs az az akadály , amit ne lenne képes legyõzni .
	kwic: lenne képes legyõzni
	kwic_new: amit ne lenne képes legyõzni
Original sent: Igaz , szinte minden iránt érdeklõdik , amire felhívják a figyelmét , képes ezekbe beleásni magát , belemélyedni , de az érdeklõdése gyökeresen más területek iránt sem lohad le .
	kwic: képes ezekbe beleásni magát ,
	kwic_new: képes ezekbe beleásni magát , belemélyedni
Original sent: Hogy talán majd egyszer , valamikor , képesek leszünk lemondani róla - egyszer s mindenkorra , véglegesen .
	kwic: képesek leszünk lemondani róla -
	kwic_new: talán egyszer képesek leszünk lemondani róla - egyszer ,
Original sent: NEM az az igazi férfi , aki minden nõt meghódít , hanem aki képes feladni mindet egyetlen egyért !
	kwic: aki képes feladni mindet egyetlen
	kwic_new: aki képes feladni mindet egyetlen egyért
Original sent: Az Együtt - PM Szövetség társelnöke szerint természetesen vannak összetûzések , hiszen a megfelelõ embereket kell megtalálni , akik képesek szembeszállni a Fidesz jelöltjeivel .
	kwic: akik képesek szembeszállni a Fidesz
	kwic_new: akik képesek szembeszállni a Fidesz jelöltjeivel
Original sent: Tisztázzák a félreértést , ki mit miért csinált úgy , ahogy és ha tisztázzák ezeket a kérdéseket , egészen más színben fogja látni a múltat és képes lesz továbblépni .
	kwic: képes lesz továbblépni
	kwic_new: képes lesz továbblépni
Original sent: Tisztázzák a félreértést , ki mit miért csinált úgy , ahogy és ha tisztázzák ezeket a kérdéseket , egészen más színben fogja látni a múltat és képes lesz továbblépni .
	kwic: képes lesz továbblépni
	kwic_new: képes lesz továbblépni
Original sent: Tisztázzák a félreértést , ki mit miért csinált úgy , ahogy és ha tisztázzák ezeket a kérdéseket , egészen más színben fogja látni a múltat és képes lesz továbblépni .
	kwic: képes lesz továbblépni
	kwic_new: képes lesz továbblépni
Original sent: Tisztázzák a félreértést , ki mit miért csinált úgy , ahogy és ha tisztázzák ezeket a kérdéseket , egészen más színben fogja látni a múltat és képes lesz továbblépni .
	kwic: képes lesz továbblépni
	kwic_new: képes lesz továbblépni
Original sent: Tisztázzák a félreértést , ki mit miért csinált úgy , ahogy és ha tisztázzák ezeket a kérdéseket , egészen más színben fogja látni a múltat és képes lesz továbblépni .
	kwic: képes lesz továbblépni
	kwic_new: képes lesz továbblépni
Original sent: Az eset már régen volt , mégsem képes napirendre térni felette , folyamatosan ott motoszkált Önben .
	kwic: képes napirendre térni felette ,
	kwic_new: mégsem képes napirendre térni felette ,
Original sent: Lázadni túl öreg , belenyugodni fiatal Szabó Benedek a huszonöt évesek problémáiról írt dalához hangulatos klip készült , csak az istenért nem képesek elkapni azt az ananászt ?
	kwic: nem képesek elkapni azt az
	kwic_new: istenért nem képesek elkapni azt az ananászt
Original sent: Egy másik amerikai , a bûvész Sid Waterman ( Allen ) elõadását nézve meghökkenve veszi észre , hogy egyedül õ képes látni és hallani Joe-t .
	kwic: õ képes látni és hallani
	kwic_new: egyedül õ képes látni és hallani Joe-t
Original sent: Még a jól kijárt útról is képes letérni , ha a szükséges tervei megvalósításához .
	kwic: is képes letérni , ha
	kwic_new: Még útról is képes letérni , ha megvalósításához
Original sent: Ezek közül az ALA , valódi esszenciális zsírsav , mivel ezt az emberi szervezet nem képes megszintetizálni .
	kwic: nem képes megszintetizálni
	kwic_new: ezt szervezet nem képes megszintetizálni
Original sent: De ilyenkor mindig képes úgy irányítani az embereket , hogy észrevétlenül álljanak be Ön mellé és csak akkor jöjjenek rá , hogy mégiscsak az lett , amit Ön szeretett volna , amikor már a siker édes ízét kóstolgatják .
	kwic: képes úgy irányítani az embereket
	kwic_new: De ilyenkor mindig képes úgy irányítani az embereket , hogy
Original sent: Bizonyára mind hallottatok a kardról , mely még halhatatlant is képes ölni .
	kwic: is képes ölni
	kwic_new: mely még halhatatlant is képes ölni
Original sent: A berkeley-i laboratriumban kifejlesztett speciális anyaggal bevont üvegfelületek képesek ugyanúgy átengedni a fényt , mint [ ... ]
	kwic: képesek ugyanúgy átengedni a fényt
	kwic_new: üvegfelületek képesek ugyanúgy átengedni a fényt , mint
Original sent: Kitiltják a Shellt Alaszkából A tengeri olajfúrások engedélyezéséért felelõs amerikai belügyminiszter , Ken Salazar kijelentette , a Shell addig nem kap engedélyt alaszkai fúrásai folytatására , amíg be nem bizonyítja , hogy képes kezelni a sarkköri viszonyokat .
	kwic: hogy képes kezelni a sarkköri
	kwic_new: hogy képes kezelni a sarkköri viszonyokat
Original sent: A bank tisztában van azzal , hogy az adós kétszer akkora törlesztõrészletet nem képes elviselni - ezzel eleve a bedõlésre játszik .
	kwic: nem képes elviselni - ezzel
	kwic_new: törlesztõrészletet nem képes elviselni - ezzel
Original sent: Ha egy gazdaság képes volt megtermelni a termékeket , akkor az ehhez szükséges pénz is jelen volt a gazdaságban .
	kwic: képes volt megtermelni a termékeket
	kwic_new: gazdaság képes volt megtermelni a termékeket ,
Original sent: Mennyi idõ alatt képes elérni ezt a célt , illetve mennyi idõ alatt képes elõteremteni a hozzá szükséges eszközöket .
	kwic: alatt képes elõteremteni a hozzá
	kwic_new: idõ alatt képes elõteremteni a hozzá eszközöket
Original sent: Akik 1990-ben képesek voltak megvásárolni a lakásaikat , azok jobbára tulajdonképp csak úgymond " visszavették " a pénzüket .
	kwic: képesek voltak megvásárolni a lakásaikat
	kwic_new: Akik 1990-ben képesek voltak megvásárolni a lakásaikat ,
Original sent: Ebben az esetben az egyén azért választja a visszavonulást , mert fél a 3 dimenziós világ valóságától , és attól a felelõsségtõl , ami azzal jár , hogy valaki fizikai testben van leföldelve ; attól fél , hogy a 3D-s világ megfertõzi , bemocskolja , ezért aztán teljesen visszavonul a felsõ csakráiba , és szó szerint átsodródik az életen , anélkül , hogy bármit is képes lenne leföldelni .
	kwic: képes lenne leföldelni
	kwic_new: bármit képes lenne leföldelni
Original sent: Többek között ezért törekednek arra , hogy minden piac és ország olyan szoros kapcsolatban legyen a másikkal , hogy néhány intézkedéssel valamennyit képesek legyenek tönkretenni ( a késõbbiekben pedig könnyebben irányítani ) .
	kwic: képesek legyenek tönkretenni ( a
	kwic_new: intézkedéssel valamennyit képesek legyenek tönkretenni ( a irányítani
Original sent: Egy elhízott ember nem képes úgy futni , ahogy a nagykönyvben megvan írva , mert a testtel együtt a stílus is változik és folyamatosan alkalmazkodik az aktuális állapothoz és ráadásul folyamatosan újra kell programoznunk az agyunkat .
	kwic: képes úgy futni , ahogy
	kwic_new: ember nem képes úgy futni , ahogy megvan
Original sent: Ezernyi sebbõl megannyi vércsepp , A lélek szennyét lemosni képes !
	kwic: lélek szennyét lemosni képes
	kwic_new: A lélek szennyét lemosni képes
Original sent: A kihívások azért vannak , hogy tanítsanak nekünk valamit , erõsebbé tegyenek és megingassák azzal kapcsolatos hiedelmeinket , hogy mit vagyunk képesek legyõzni és mit nem .
	kwic: vagyunk képesek legyõzni és mit
	kwic_new: mit vagyunk képesek legyõzni és mit nem
Original sent: Az új dimenzió térhódítását a tévés piacon jól mutatja , hogy a GfK Hungária ügyfélkapcsolati menedzserének közlése szerint az eladott LCD készülékek 78 százaléka már 3D-s tartalmat is képes megjeleníteni .
	kwic: is képes megjeleníteni
	kwic_new: szerint százaléka már tartalmat is képes megjeleníteni
Original sent: Elektromotorral akár 120 km/órás tempóra is képes felgyorsulni a nagy méretû SUV , amelynek fogyasztása 3,8 l/100 km alatt marad .
	kwic: is képes felgyorsulni a nagy
	kwic_new: Elektromotorral akár tempóra is képes felgyorsulni a nagy SUV , marad
Original sent: Az akkumulátora akár 10 perc alatt is feltölthetõ , ezzel pedig megközelítõleg 100 kilométert képes megtenni , akár 60 km/h-s sebességgel is . - cikk vége - Ezt olvastad már ?
	kwic: kilométert képes megtenni , akár
	kwic_new: ezzel pedig megközelítõleg 100 kilométert képes megtenni , akár sebességgel
Original sent: A vasárnapi Magyar Nagydíj után nem kérdés , hogy a futamot megnyerõ Lewis Hamilton volt a verseny hõse , mert bár a pole pozícióból rajtolva gyõzött , a diadal érdekében elképesztõ elõzéseket is bemutatott , kerékcseréi után Jenson Buttont és Mark Webbert is képes volt megelõzni a Hungaroringen , ahol még mindig pokolian nehéz elõzni .
	kwic: képes volt megelõzni a Hungaroringen
	kwic_new: bár Buttont is képes volt megelõzni a Hungaroringen , elõzni
Original sent: www.Bien.hu &verbar; Vízöntõ aug. 23 , péntek : Képes elnyerni olyan emberek bizalmát is a mai napon , akikkel évek óta teljesen ellenkezõ elveket vallottak .
	kwic: : Képes elnyerni olyan emberek
	kwic_new: : Képes elnyerni olyan emberek bizalmát is napon , vallottak
Original sent: Szívesen beszélget , még önmagát is meglepi , milyen õszintén képes feltárni lelke legmélyebbnek gondolt titkait .
	kwic: õszintén képes feltárni lelke legmélyebbnek
	kwic_new: milyen õszintén képes feltárni lelke legmélyebbnek titkait
Original sent: Ismeretlen titkok , lélegzetelállító helyszínek , ritka mûtárgyak és titkos kincses térképek , amelyek képesek megváltoztatni a világ erõegyensúlyát .
	kwic: amelyek képesek megváltoztatni a világ
