Original sent: A Solazyme az elterjedtebb eljárásoktól eltérõen - amelyeknél egy köztes , fotoszintézisen alapuló lépés szükséges - olyan genetikailag módosított algákat használ , melyek segítségével cukrokat közvetlenül olajokká képesek átalakítani , majd ezekbõl állítják elõ a végterméket .
	kwic: olajokká képesek átalakítani , majd
	kwic_new: amelyeknél segítségével cukrokat közvetlenül olajokká képesek átalakítani , majd
Original sent: Nem olvasta viszont ezt például az a Cser Palkovics András viceszóvivõ , aki hétfõn a fóti korrupciógyanús botrány ügyében ezt volt képes kiizzadni magából a narancs riadó idején : " Nyilvánvaló provokáció és szánalmas figyelemelterelési kísérlet a szocialisták akciója ...
	kwic: volt képes kiizzadni magából a
	kwic_new: aki hétfõn ügyében ezt volt képes kiizzadni magából a idején : provokáció
Original sent: A brüsszeli hölgy legnagyobb bûne persze az , hogy képes volt fogadni a Klubrádió küldötteit , meghallgatta hazugságaikat , majd ellenõrzés nélkül tovább is adta õket .
	kwic: képes volt fogadni a Klubrádió
	kwic_new: képes volt fogadni a Klubrádió küldötteit ,
Original sent: Egy mai tizenéves képes úgy beszélni , hogy a 21. századi szókincsnek csak apró részleteit értsék a szülõk .
	kwic: képes úgy beszélni , hogy
	kwic_new: mai tizenéves képes úgy beszélni , hogy értsék
Original sent: Sajnos az a tapasztalat , hogy némely képzõintézmények ügyes marketingfogásokkal a tájékozatlan emberek jóhiszemûségével visszaélve háromszoros áron is képesek árulni a képzéseket , azonban az irreálisan magas ár legtöbbször nem takar minõségi oktatást .
	kwic: is képesek árulni a képzéseket
	kwic_new: marketingfogásokkal jóhiszemûségével visszaélve áron is képesek árulni a képzéseket , azonban
Original sent: Õ ugyanis még a gyûlés elõtt elmondta , nem hisz abban , hogy a republikánus jelölt képes fordítani az álláson a választásig hátralévõ idõben .
	kwic: jelölt képes fordítani az álláson
	kwic_new: a republikánus jelölt képes fordítani az álláson
Original sent: A kulturált kétliteres blokk ezen a fordulaton is képes gyorsítani , de az igazi élmény kétezer környékén jön meg , ilyenkor úgy viselkedik az autó , ahogy elképzeltük a metró megállóban az óriásplakáton .
	kwic: is képes gyorsítani , de
	kwic_new: blokk fordulaton is képes gyorsítani , de jön
Original sent: Az idõjárás viszontagságai ellen szigetelt kamera autófókusza villámgyorsan mûködik , melyre szükség is van , ugyanis 5 képet képes másodpercenként készíteni a D2Xs teljes felbontásban , sõt akár 8 fotó is rögzíthetõ másodpercenként ( ! ) hét megapixeles felbontás mellett .
	kwic: képes másodpercenként készíteni a D2Xs
	kwic_new: képet képes másodpercenként készíteni a D2Xs felbontásban , sõt mellett
Original sent: Ha a baba nagyobb lesz , és huzamosabb ideig képes megtartani a fejét , a látóterébe helyezett játékokkal lehet nézelõdésre és nyújtózkodásra ösztönözni .
	kwic: ideig képes megtartani a fejét
	kwic_new: huzamosabb ideig képes megtartani a fejét , ösztönözni
Original sent: Hogy a teratómákban a legkülönbözõbb szövetek csökevényes másai megtalálhatók , az pontosan azt tükrözi , hogy e daganatok kiindulásául szolgáló sejtek pluripotensek , vagyis mindenféle szövetté képesek alakulni .
	kwic: szövetté képesek alakulni
	kwic_new: mindenféle szövetté képesek alakulni
Original sent: Az éhes agy nem képes ellenállni az édességeknek A gyermekorvosok szerint sok a hiba a kisgyerekek táplálásában Egyelõre nem engedélyezett az EU-ban a jázminpakóca A xilitol , xilit vagy nyírfacukor elnevezés tulajdonképpen ugyanazt a növényekbõl kivont cukoralkoholt jelöli , amely bizonyítottan gátolja bizonyos baktériumok , elsõsorban a fogszuvasodásért felelõs Streptococcus mutans növekedését és savtermelését .
	kwic: nem képes ellenállni az édességeknek
	kwic_new: nem képes ellenállni az édességeknek
Original sent: Hermann Dietzfelbinger 20. századi német teológus Jézus Krisztus és a napnyugati bölcsek címû könyvében fölveti az izgalmas kérdést : vajon mikor lesznek képesek leborulni a napnyugati bölcsek is a betlehemi jászolbölcsõnél ?
	kwic: lesznek képesek leborulni a napnyugati
	kwic_new: vajon mikor lesznek képesek leborulni a napnyugati is jászolbölcsõnél
Original sent: Egyes férfiak olyan szélsõségesen kevés érintésben részesültek gyermekkoruk során , hogy kialakítják magukban azt az elképzelést , erre nincs is szükség két ember között , s ennek eredményeképpen azt sem képesek megérteni , a nõknek miért van szükségük folyamatosan arra , hogy öleljék , simogassák , cirógassák õket .
	kwic: sem képesek megérteni , a
	kwic_new: eredményeképpen azt sem képesek megérteni , a
Original sent: De akár a munkanélküliségi adatokat nézzük , akár a sorra bezárni kényszerülõ boltokat , akár a felfoghatatlan módon még tovább szegényedni képes falvakat , akár a Széchenyi után száznyolcvan évvel hitelhiányban fuldokló vállalkozásokat , akár a lakosság várakozásairól szóló felméréseket nézzük , egyértelmû : a magyarok többsége semmi ilyesmit nem érez .
	kwic: még tovább szegényedni képes falvakat
	kwic_new: módon még tovább szegényedni képes falvakat , akár
Original sent: Kifejtette , a regionális operatív programokban támogatott fejlõdõ klaszterekbõl pedig 67 esetében látszik , hogy képes megszerezni az akkreditációt .
	kwic: hogy képes megszerezni az akkreditációt
	kwic_new: hogy képes megszerezni az akkreditációt
Original sent: Hozzátette : várhatóan nem minden telep lesz majd képes teljesíteni a követelményeket .
	kwic: majd képes teljesíteni a követelményeket
	kwic_new: majd képes teljesíteni a követelményeket
Original sent: Ezzel a piacteremtõ kezdeményezéssel innovatív , komplex ajánlatot képes nyújtani , amely rugalmasan alakítható az Önkormányzatok és intézményrendszerei , valamint az oktatási intézmények , a mobiltelefonos megoldás segítségével pedig gyakorlatilag minden mobiltulajdonos számára .
	kwic: ajánlatot képes nyújtani , amely
	kwic_new: kezdeményezéssel innovatív , komplex ajánlatot képes nyújtani , amely alakítható számára
Original sent: A Lotusnál is debütál a spéci kipufogó A Lotus Japánban sem veti be a dupla DRS-t Grosjean : Jövõre képes lesz nyerni a Lotus A Lotus feltámadásra készül Szinte biztosnak tûnik , hogy a Lotus nem végez a 4. pozíciónál hátrébb a konstruktõri tabellán - ennyire elõkelõ helyen legutóbb 2008-ban , még Renault néven zárt az enstone-i istálló .
	kwic: képes lesz nyerni a Lotus
	kwic_new: Jövõre képes lesz nyerni a Lotus
Original sent: " Biztos vagyok benne , hogy képes lesz nyerni .
	kwic: képes lesz nyerni
	kwic_new: képes lesz nyerni
Original sent: Nicklas Bendtner mindig is az a játékos volt a fejünkben , aki bárhonnan képes kihagyni a helyzetet , épp ezért jelentett kellemes csalódást , hogy két szép gólt is szerzett a tornán .
	kwic: bárhonnan képes kihagyni a helyzetet
	kwic_new: bárhonnan képes kihagyni a helyzetet ,
Original sent: Azt is mondta , hogy " nem nagyon ismer olyan kormányt , amely ilyen határozottan képes válaszolni " az EU hibás helyzetértékelésére .
	kwic: határozottan képes válaszolni " az
	kwic_new: amely ilyen határozottan képes válaszolni " az helyzetértékelésére
Original sent: A jogvédõ szervezetek szerint Magyarországon nincs olyan hatóság , amely a családon belüli erõszakot képes lenne megelõzni , megakadályozni vagy magát a problémát kezelni .
	kwic: képes lenne megelõzni , megakadályozni
	kwic_new: amely erõszakot képes lenne megelõzni , megakadályozni vagy
Original sent: Nem kap pénzt az államtól , aki képes lenne dolgozni , mégsem hajlandó .
	kwic: képes lenne dolgozni , mégsem
	kwic_new: aki képes lenne dolgozni , mégsem hajlandó
Original sent: A rendszer azt is képes kiszámítani , hogy egy-egy bombát mennyivel korábban kell kilõi , hogy éppen a zenéhez igazítva robbanjon .
	kwic: is képes kiszámítani , hogy
	kwic_new: rendszer azt is képes kiszámítani , hogy kell
Original sent: Ez azért veszélyes , mert a tártól függõen 30 , 40 vagy 72 lövést leadni képes fegyverbe páncéltörõ lövedék is helyezhetõ .
	kwic: 72 lövést leadni képes fegyverbe
	kwic_new: tártól 30 72 lövést leadni képes fegyverbe
Original sent: " Változatlanul azt tartjuk ugyanis , hogy a konkrét , szakpolitikai megoldásokat érintõ egyeztetésekre már olyan szervezetek között kell sort keríteni , amelyek nemcsak szóban értenek egyet a korszakváltás programjában , de a korszakváltó elvi , erkölcsi alapvetések jogszabállyá formálásában is készek és képesek részt venni " - fogalmazott az Együtt 2014 .
	kwic: képesek részt venni " -
	kwic_new: formálásában is készek képesek részt venni " -
Original sent: Mint a Jediót Ahronót címû izraeli lap pénteken jelentette , az egyik ilyen fegyver , melyet " bionikus lódarázsnak " kereszteltek el , egy a névadónak megfelelõ méretû repülõ robot lenne , amely keskeny sikátorokban is képes navigálni és megtalálni olyan , más módon elérhetetlen ellenséges fegyvereket , mint például a rakétavetõk .
	kwic: is képes navigálni és megtalálni
	kwic_new: amely sikátorokban is képes navigálni és megtalálni fegyvereket
Original sent: Az elõzõ kormányfõ , Kan Naoto - aki alig több mint egy évig volt miniszterelnök - a héten mondott le azután , hogy kemény bírálatok érték , mert kormánya nem volt képes megbirkózni az országot sújtó márciusi kettõs csapás , a földrengés elõidézte szökõár és az azt követõ fukusimai atomkatasztrófa következményeivel .
	kwic: volt képes megbirkózni az országot
	kwic_new: kormánya nem volt képes megbirkózni az országot következményeivel
Original sent: Némi reform ellenére a bíróságokat is átitatja a korrupció , és az igazságszolgáltatás nem képes útját állni a jogsértéseknek .
	kwic: képes útját állni a jogsértéseknek
	kwic_new: igazságszolgáltatás nem képes útját állni a jogsértéseknek
Original sent: Fontos a kísértésnek kitenni magunkat , majd hirtelen kilépni a helyzetbõl , például kisietni a boltból , és amikor odakint csökken a feszültség , újra és újra megerõsíteni önmagunkat abban : milyen nagyszerû , hogy képesek voltunk ellenállni a vásárlásnak .
	kwic: képesek voltunk ellenállni a vásárlásnak
	kwic_new: képesek voltunk ellenállni a vásárlásnak
Original sent: A Bak ráadásul imád gyõzni , és rettentõ kitartó , tehát nehezen képes elismerni , ha valamiben veszített vagy ha nem lett igaza .
	kwic: nehezen képes elismerni , ha
	kwic_new: kitartó nehezen képes elismerni , ha veszített vagy
Original sent: Sokkal gyorsabb tempóban vagy képes dolgozni mostanában , mint más napokon , és úgy érzed , sokkal jobban átlátod az problémákat , vitás helyzeteket is : ez pedig nagyot dobhat az önbizalmadon !
	kwic: vagy képes dolgozni mostanában ,
	kwic_new: tempóban vagy képes dolgozni mostanában , mint , és
Original sent: Ez a 10 kategória : a terveik és céljaik mennyire egyformák , hogyan mûködik a kommunikáció kettõjük között , hogyan kezelik a konfliktusokat , hogyan állnak a pénzügyekhez , mit gondolnak a szülõi szerepekrõl , el tudják -e fogadni egymás családját , barátait , milyen szereposztást képzelnek el egy kapcsolatban , mennyire szeretnék egyformán tölteni a szabadidejüket , illetve a lelkiség és szexualitás területén mennyire képesek együttmûködni .
	kwic: mennyire képesek együttmûködni
	kwic_new: területén mennyire képesek együttmûködni
Original sent: Ha õ a pályán van , képes átalakítani csapata játékát , puszta jelenlétével gyõztes együttessé teheti a Romát " - mondta Laurent Blanc , a Bordeaux vezetõedzõje , majd hozzátette , elsõsorban jól kell védekezniük , mert csak akkor lesz esélyük a gyõzelemre .
	kwic: , képes átalakítani csapata játékát
	kwic_new: , képes átalakítani csapata játékát
Original sent: http://videa.hu/flvplayer.swf?v=306hlN8wxdvtq1e0A labdába szerelt csip a hozzá kapcsolódó rendszer segítségével képes lenne jelezni , hogy a labda áthaladt -e a gólvonalon .
	kwic: képes lenne jelezni , hogy
	kwic_new: csip segítségével képes lenne jelezni , hogy áthaladt
Original sent: Ráadásul akik elõttem állnak a rangsorban , jól is teljesítenek , lövik a gólokat , de szerintem így is képes lennék kiharcolni a helyemet a csapatban . "
	kwic: képes lennék kiharcolni a helyemet
	kwic_new: szerintem így képes lennék kiharcolni a helyemet csapatban
Original sent: Roberto Mancini csapata 14 fordulón keresztül veretlen maradt , és amikor a MU ellen idegenben 6-1-re nyert , és öt pont elõnnyel élen állt , nem sokan gondolták , hogy a címvédõ képes lehet fordítani .
	kwic: képes lehet fordítani
	kwic_new: címvédõ képes lehet fordítani
Original sent: Az RSF szerint a terv annál inkább aggasztó , mert a kínai kormány felfedte , hogy rendelkezik egy új , a honlapokat folyamatosan megfigyelni képes rendszerrel , amely megtalálja azokat a webhelyeket , amelyek mûködtetõi nem tesznek eleget a rendeletnek .
	kwic: honlapokat folyamatosan megfigyelni képes rendszerrel
	kwic_new: egy új , a honlapokat folyamatosan megfigyelni képes rendszerrel
Original sent: Ha az egyik támadó az autó mellett tartózkodik egy antennával , a másik pedig a tulajdonos mellé sétál egy másik adóvevõ egységgel , akkor a kulcs távolról is képes kinyitni a jármûvet .
	kwic: is képes kinyitni a jármûvet
	kwic_new: akkor kulcs távolról is képes kinyitni a jármûvet
Original sent: http://www.youtube-nocookie.com/v/WQxki9SvDxc?fs=1&amp;amp ; hl = hu_HU&amp;amp ; rel = 0 Az ugráló kép eltereli a figyelmet a képkockákon látható történésekrõl , az ír cég megoldása azonban képes detektálni az egyes képkockák elhelyezkedése közötti nem kívánatos különbséget , és a képkockák digitális manipulálásával kiegyensúlyozni a kamera véletlen mozgását .
	kwic: azonban képes detektálni az egyes
	kwic_new: megoldása azonban képes detektálni az egyes különbséget , és
Original sent: Bár az eredmények szerint sok fiatal van , aki Facebook és okostelefon nélkül is képes lenne élni , a kutatás összegzése szerint a mai tinik el sem tudnánk képzelni , hogy milyen lehet ilyen eszközök és oldalak nélkül .
	kwic: képes lenne élni , a
	kwic_new: aki Facebook nélkül képes lenne élni , a
Original sent: Ám az újszerû , független pénzügyi rendszernek is megvannak a maga problémái , ugyanis nem csak a befektetõi bizalom gyengülése , hanem hackertámadások is képesek befolyásolni a Bitcoin árfolyamát .
	kwic: is képesek befolyásolni a Bitcoin
	kwic_new: gyengülése is képesek befolyásolni a Bitcoin árfolyamát
Original sent: " Láttuk , hogy mi történhet olyasvalakivel , mint Jennifer Aniston , aki eszméletlenül sikeres volt a tévében , de úgy tûnik , hogy egy nagyfilmet nem képes elvinni " - nyilatkozta az " informátor " .
	kwic: nem képes elvinni " -
	kwic_new: nagyfilmet nem képes elvinni " -
Original sent: A TMZ birtokába került iratok szerint Tony Parker és Eva Longoria esküvõjén a fõnök azzal tréfálkozott , hogy Parker alighanem meleg , ha képes feleségül venni egy ilyen " apró , kicsi lányt , mellek nélkül , aki úgy néz ki , mint egy fiúcska " .
	kwic: képes feleségül venni egy ilyen
	kwic_new: képes feleségül venni egy ilyen lányt
Original sent: " Megkerülheti a beépülés normális útját , és esetleg a szem nem képes feldolgozni " .
	kwic: nem képes feldolgozni "
	kwic_new: esetleg szem nem képes feldolgozni "
Original sent: Képesek utánozni a hagyományos számítógépes áramkörök mûködését .
	kwic: Képesek utánozni a hagyományos
	kwic_new: Képesek utánozni a hagyományos mûködését
Original sent: A csapok ezzel szemben csak jó fényviszonyok mellett mûködnek , akkor viszont sokkal több információt adnak : színek gazdag skáláját képesek feldolgozni .
	kwic: skáláját képesek feldolgozni
	kwic_new: színek gazdag skáláját képesek feldolgozni
Original sent: Az elmúlt években kiderült , hogy az élet a legzordabb helyeken is képes fennmaradni a Földön , még a földkéreg kõzeteit is hatalmas menyiségû baktérium népesíti be .
	kwic: is képes fennmaradni a Földön
	kwic_new: helyeken is képes fennmaradni a Földön ,
Original sent: A szakemberek azt várják , hogy az új kutatási program keretében hatékony gyógymódokat dolgozhatnak ki a súlyos gerincsérültek számára , akiknél a jelenlegi terápiák nem képesek visszaállítani a járóképességet .
	kwic: nem képesek visszaállítani a járóképességet
	kwic_new: akiknél terápiák nem képesek visszaállítani a járóképességet
Original sent: A zsúfolt nyári idõszakban egy-egy gépsor óránként akár kétszáz utast képes átvilágítani a korábbi százhatvan helyett .
	kwic: utast képes átvilágítani a korábbi
	kwic_new: idõszakban gépsor óránként kétszáz utast képes átvilágítani a korábbi helyett
Original sent: 19.46 A brit pénzügyminiszter bízik az uniós vezetõkben George Osborne brit pénzügyminiszter Cannes-ban , a G20-as csúcson arról beszélt , hogy az európai vezetõk képesek megoldani a válságot , és az eurózóna szerinte jelentõs döntéseket hozott .
	kwic: vezetõk képesek megoldani a válságot
	kwic_new: az európai vezetõk képesek megoldani a válságot , és
Original sent: Valahogy mindig kacsintgattam kifelé , de mégsem tettem semmit soha . ( polmekartni ) - Ön lehet az a derék , a kísértésnek ellenállni képes ingerkeresõ , akirõl fentebb már szóltam , aki bár szívesen félrelépett volna , de képes volt ezt megállni .
	kwic: a kísértésnek ellenállni képes ingerkeresõ
	kwic_new: a kísértésnek ellenállni képes ingerkeresõ
Original sent: Kulturális körutak &gt;&gt;&gt; http://utazas.origo.hu/kulturalis_korutak/kategoria?t=113 Az [ origo ] Utazás ajánlataMiért tudnak most sokkal olcsóbb kötelezõ ajánlatokat adni , eddig lehúztak minket ? [ paporu ] - Már 16 éve mûködik ez a rendszer , így a biztosítóknak olyan adatok állnak rendelkezésükre , hogy a díjszabásaikat képesek finomítani .
	kwic: díjszabásaikat képesek finomítani
	kwic_new: a díjszabásaikat képesek finomítani
Original sent: A szakember azt mondta , az éves 300 ezer tonnás felhasználáshoz képest ez a mennyiség csekély ugyan , hosszas hatást nem képes gyakorolni az árakra , de ahhoz elég lehet , hogy stabilizálja azokat , miközben a világpiacon is csökkenés indult el .
	kwic: nem képes gyakorolni az árakra
	kwic_new: képest mennyiség hatást nem képes gyakorolni az árakra , de
Original sent: Ott szerdától vasárnapig errõl a fajta reménységrõl lesz szó , a mindenható és szeretetteljes Istenbe vetett reménységrõl , aki képes rendbe hozni a reménytelennek tûnõ helyzeteket is , és ha az õ kezébe helyezzük a kis életünket , még a halálon túl is biztonságban tudhatjuk magunkat .
	kwic: képes rendbe hozni a reménytelennek
	kwic_new: aki képes rendbe hozni a reménytelennek helyzeteket ,
Original sent: Úgy vélte , ha újra meglesz a minõségi élet lehetõsége a vidéken , akkor a vidék ugrásszerûen képes lesz javítani a városi élet minõségét is , amit " a külföldrõl ideáramló silány kacatok , élelmiszer- ipari hulladék dömpingje alacsony szinten , sõt sokszor emberhez méltatlan szinten tart " .
	kwic: képes lesz javítani a városi
	kwic_new: ha akkor ugrásszerûen képes lesz javítani a városi minõségét is , tart
Original sent: A második vizsgálatból kiderült , hogy a 6 évnél fiatalabb gyermekek képesek külön-külön kezelni a kétféle információt , míg a felnõttek nem rendelkeznek ezzel a képességgel .
	kwic: képesek külön-külön kezelni a kétféle
	kwic_new: gyermekek képesek külön-külön kezelni a kétféle információt , rendelkeznek
Original sent: A korszerû laboratóriumi munkát megvalósítani képes és a tanulók széles körét a kísérletezésbe bevonó , speciális szaktudást garantáló képzések lebonyolítása , a mûködtetéshez szükséges szakemberek alkalmazásának , valamint a projektidõszakban lebonyolított tanórák anyagi feltételeinek biztosítása .
	kwic: laboratóriumi munkát megvalósítani képes és
	kwic_new: korszerû laboratóriumi munkát megvalósítani képes és bevonó
Original sent: Hozzátette : a belsõ helyiségek tervezésekor gyakran gondoltak a kivitelezés nehézségeire , de összességében jó döntés született , mert a kerek épület küllemében is kellemes , egy fejlõdni képes kisváros arculatát mutatja az autópálya felõl érkezõknek .
	kwic: , egy fejlõdni képes kisváros
	kwic_new: kellemes , egy fejlõdni képes kisváros
Original sent: A gyerekek fáradhatatlanok , nekik sosem elég a strandolás , így ha megéheznek , egy felnõtt adagját képesek bevágni , majd utána folytatódhat a móka a sok medence egyikében .
	kwic: adagját képesek bevágni , majd
	kwic_new: egy felnõtt adagját képesek bevágni , majd
Original sent: Ha az állam nem képes fenntartani egy intézményt , akkor jobban kellene az önkormányzatokra és a civil szférára támaszkodni .
	kwic: nem képes fenntartani egy intézményt
	kwic_new: állam nem képes fenntartani egy intézményt ,
Original sent: Összegezve talán úgy fogalmazhatunk , hogy a hatalmi szerkezet erõtere hívja elõ a személyiségtípusok sokaságából az adott pillanatban rezonálni , együttmûködni képes egyedeket , melyek aztán visszahatnak , leginkább erõsítõleg a hatalmi struktúrára .
	kwic: rezonálni , együttmûködni képes egyedeket
	kwic_new: sokaságából pillanatban rezonálni , együttmûködni képes egyedeket , visszahatnak erõsítõleg struktúrára
Original sent: Létezésük és megítélésük általában vita tárgya , érdekességük azonban , hogy a klasszikus rendszerezés alapján besorol(hat)atlan , úgynevezett szigetnyelveket is magukba képesek foglalni .
	kwic: magukba képesek foglalni
	kwic_new: szigetnyelveket is magukba képesek foglalni
Original sent: Még a megerõsített palánkkal ellátott sorhajók sem voltak képesek ellenállni az új típusú lövedékeknek , ezért az ostromlövegek egy részét Szevasztopol ostroma során erõs vasborítású bárkákon helyezték el - ezek jól ellenálltak az orosz várvédõ ágyúk tüzének .
	kwic: voltak képesek ellenállni az új
	kwic_new: Még sorhajók voltak képesek ellenállni az új lövedékeknek , ezért
Original sent: A napsugár pillanatnyi ragyogása , egy árnyék , mely az utat keresztezi , egy idõmarta tölgy vagy egy mohlepte kõ képes megindítani a gondolatok és érzések sorozatát , fölébreszteni a festõ képzeletet . "
	kwic: kõ képes megindítani a gondolatok
	kwic_new: egy mohlepte kõ képes megindítani a gondolatok és sorozatát , fölébreszteni
Original sent: A negyedik tétel azzal kapcsolatos , hogy az ember mennyiben képes ellenállni Istennek .
	kwic: mennyiben képes ellenállni Istennek
	kwic_new: ember mennyiben képes ellenállni Istennek
Original sent: Az ekkor tizenegy fõbõl álló Bölcsek Tanácsa úgy döntött , hogy a népgyûlés ( olaszul : Assemblea Generale ) nem képes megfelelõen dönteni a város vezetõjének megválasztásáról .
	kwic: képes megfelelõen dönteni a város
	kwic_new: népgyûlés nem képes megfelelõen dönteni a város megválasztásáról
Original sent: Wi-Fi hotspotok találhatók például számos kávézóban , amelyek jellemzõen túlterheltek és alacsony feltöltési sebességgel képesek csak biztosítani az internetet .
	kwic: képesek csak biztosítani az internetet
	kwic_new: sebességgel képesek csak biztosítani az internetet
Original sent: Habár a folyamat jól mûködik és fontos szerepet játszik az autoimmunitás elleni védekezésben , nem képes megakadályozni , hogy érett autoreaktív limfociták kerüljenek a perifériára .
	kwic: nem képes megakadályozni , hogy
	kwic_new: nem képes megakadályozni , hogy kerüljenek
Original sent: Falánk ragadozók , szinte bármilyen kisebb állatot elfogyasztanak , amit képesek elkapni és lenyelni , így különféle férgeket , puhatestûeket , ízeltlábúakat , halakat , kétéltûeket , hüllõket és kisemlõsöket .
	kwic: amit képesek elkapni és lenyelni
	kwic_new: amit képesek elkapni és lenyelni
Original sent: Akár 56 km/órával is képes szaladni a sziklás vidéken .
	kwic: is képes szaladni a sziklás
	kwic_new: Akár km/órával is képes szaladni a sziklás vidéken
Original sent: A gyõzelem eredményeként gyakorlatilag nem maradt a brit haditengerészettel szembeszállni képes flotta a világtengereken , és 1805-tõl 1914-ig " Britannia uralkodott a habok felett " .
	kwic: brit haditengerészettel szembeszállni képes flotta
	kwic_new: a brit haditengerészettel szembeszállni képes flotta
