	kwic_new: eredményeképpen Bulgária képes lesz élni az EU-tagságból jogokkal 1-jén
Original sent: Nem hasznosultak azért , mert a helyben élõ emberek úgy gondolkodtak , hogy a csatornadíjat nem képesek megfizetni , kisgazdálkodással foglalkoztak , saját kertjüket mûvelték , a locsolóvíz után is ki kellett volna fizetni a csatornadíjat ; ezeket nem vállalták , és inkább nem kötöttek rá .
	kwic: nem képesek megfizetni , kisgazdálkodással
	kwic_new: csatornadíjat nem képesek megfizetni , kisgazdálkodással
Original sent: Az nyilvánvaló , hogy a jelentõs áremelkedést a magyar társadalom nagy része nem lenne képes elviselni , de a piaci folyamatok által kikényszerített áremelkedéseket nem szabad a kormánynak megakadályozni , hanem szociális intézkedésekkel kell azokat kompenzálni .
	kwic: lenne képes elviselni , de
	kwic_new: áremelkedést része nem lenne képes elviselni , de szabad
Original sent: A mostani megállapodás mutatja , hogy az eltérõ politikai értékrendeket képviselõ pártok képesek felismerni azokat a nemzeti érdekeket , amelyek csak közös megegyezéssel , közös akarattal érvényesíthetõk .
	kwic: pártok képesek felismerni azokat a
	kwic_new: értékrendeket képviselõ pártok képesek felismerni azokat a érdekeket , érvényesíthetõk
Original sent: Azt kértük a Számvevõszéktõl , hogy abból a szempontból is vizsgálja , és tegyen javaslatokat a Ház elé , illetve minden egyes illetékes szerv elé ezzel kapcsolatban , hogy az önkormányzatok milyen módon képesek ellátni azokat a feladatokat , mennyire finanszírozható az a fajta feladatellátási kötelezettség , amelyet a különbözõ törvények , határozatok rájuk szabnak .
	kwic: módon képesek ellátni azokat a
	kwic_new: elé önkormányzatok milyen módon képesek ellátni azokat a feladatokat , kötelezettség , szabnak
Original sent: A közelmúltban tanúi lehettünk annak Szlovákiában , a Tátrában , hogy pusztító szélviharok milyen hatalmas károkat képesek okozni a szélsõséges idõjárási viszonyok következtében .
	kwic: károkat képesek okozni a szélsõséges
	kwic_new: szélviharok milyen hatalmas károkat képesek okozni a szélsõséges következtében
Original sent: A Magyar Honvédség nem képes teljesíteni a Magyar Köztársaság nemzetközi szerzõdésben vállalt kötelezettségeit sem .
	kwic: nem képes teljesíteni a Magyar
	kwic_new: Honvédség nem képes teljesíteni a Magyar kötelezettségeit
Original sent: Itt van , úgy gondolom , közöttünk egy elvi vita , egy elvi véleménykülönbség , amely szerint én azt mondom , hogy önmagában a verseny egy eszköz és nem egy cél , a verseny természetesen szükséges , de magukat a versennyel szemben támasztott követelményeket csak a törvény képes megmondani vagy ha úgy tetszik , a norma .
	kwic: törvény képes megmondani vagy ha
	kwic_new: önmagában követelményeket csak a törvény képes megmondani vagy ha tetszik norma
Original sent: Ha visszatekintünk , a magyar történelemben még soha nem voltunk olyan helyzetben , hogy ilyen összeg állna jó néhány esztendõ alatt az ország rendelkezésére , 8000 milliárdnyi forint , ami - lássuk be - alapvetõ változásokat képes hozni az ország életében akkor , ha ezekkel a forrásokkal tisztességgel , felelõsen gazdálkodunk .
	kwic: változásokat képes hozni az ország
	kwic_new: be alapvetõ változásokat képes hozni az ország életében
Original sent: Pontosan tudjuk , hogy ezeknek a gyõztes pályázatoknak körülbelül 80 százaléka az , ami külföldi tulajdonban lévõ vállalat , és 20 százalékra tehetõ a valójában hazai kis- és közepes vállalkozások aránya , amelyek képesek nyerni .
	kwic: amelyek képesek nyerni
	kwic_new: amelyek képesek nyerni
Original sent: Nem képesek annyit teljesíteni , mint amennyit az
	kwic: képesek annyit teljesíteni , mint
	kwic_new: Nem képesek annyit teljesíteni , mint amennyit
Original sent: is képesek voltak teljesíteni a bíróságok , és hónapok óta ez nagyjából így
	kwic: képesek voltak teljesíteni a bíróságok
	kwic_new: is képesek voltak teljesíteni a bíróságok , és
Original sent: esetben a tehetségsegítés nem képes kompenzálni a család vagy a szûk
	kwic: nem képes kompenzálni a család
	kwic_new: esetben tehetségsegítés nem képes kompenzálni a család vagy
Original sent: A másik pedig a nemzetbiztonsági bizottság , amit ellenzéki szemszögbõl nézve , azt gondoljuk , igényt tartunk arra , hogy a kormányzatot a nemzetbiztonsági bizottság és ott azon keresztül az ellenzék is - a titkosszolgálatokkal kapcsolatban az ellenzék is - ellenõrizni tudja , akkor ezt a jogkört csak akkor lehet megkívánni és gyakorolni , ha egy viszonylag szûk létszámú bizottság az , amely képes betekinteni az ügyekbe .
	kwic: amely képes betekinteni az ügyekbe
	kwic_new: amely képes betekinteni az ügyekbe
Original sent: Tehát azt gondolom , hogyha ezt több mint száz évvel ezelõtt az akkori igen szûk létszámú apparátus az akkori technikai körülmények között képes volt megcselekedni , akkor a mai körülmények között ez nem lehet probléma a mai kormányzat számára sem , vagy ha mégis problémát jelent , akkor azzal a szomorú valósággal kell szembenéznünk , hogy a jelenlegi kormány a több mint száz évvel ezelõtti kormány képességeit az akkori és mostani technikai különbözet mellett sem képes elérni .
	kwic: képes volt megcselekedni , akkor
	kwic_new: képes volt megcselekedni , akkor lehet
Original sent: Ezt az a megoldás sajnos nem volt képes megvalósítani .
	kwic: volt képes megvalósítani
	kwic_new: Ezt megoldás sajnos nem volt képes megvalósítani
Original sent: Ellenkezõleg , a szolgáltatásokért nyújtott díj az ellátások reálértékét is csak nehezen lesz képes megtartani .
	kwic: lesz képes megtartani
	kwic_new: Ellenkezõleg reálértékét nehezen lesz képes megtartani
Original sent: De elengedhetetlen volt a gazdaság stabilitásának helyreállítása , a haderõreform , az együttmûködési képesség kialakítása , a " Partnerség a békéért " programban és a boszniai béketeremtésben való aktív részvétel , amely bebizonyította , hogy Magyarország igenis hasznos tagja tud lenni a szövetségnek , nemcsak fogyasztója , nemcsak haszonélvezõje lesz a csatlakozással együtt járó biztonsági garanciáknak , de maga is képes ezekhez hozzájárulni .
	kwic: képes ezekhez hozzájárulni
	kwic_new: maga képes ezekhez hozzájárulni
Original sent: Mindent egybevetve az integrációs partnereknek is rendkívüli felelõsségük lesz , hogy a törvényjavaslat elfogadása esetén mennyiben lesznek képesek az óvó- és tanítóképzõk , de a nagy hagyományokkal rendelkezõ tanárképzõ fõiskolák is megõrizni önállóságukat , mennyire lesznek képesek fejleszteni , az arra alkalmas személyiségeket megtartani , a pedagógusi hivatás szakmai és erkölcsi tekintélyét megújítani .
	kwic: lesznek képesek fejleszteni , az
	kwic_new: mennyire lesznek képesek fejleszteni , az megtartani
Original sent: Meciar azután szólalt fel , hogy Pavol Pa¹ka házelnök élesen bírálta a mostani ellenzéket , mondván , hogy a Dzurinda-kormány csak korrupcióval és képviselõk megvásárlásával volt képes megtartani hatalmát .
	kwic: volt képes megtartani hatalmát
	kwic_new: Dzurinda-kormány korrupcióval volt képes megtartani hatalmát
Original sent: Hiszem , hogy a kétezer éve közénk jött betlehemi kisded képes akkorára tágítani szívünk , melyben elfér a népünk , nemzetünk iránti õszinte szeretet , és a szülõföldünk iránti ragaszkodás , de a velünk együtt élõ nemzetek iránti lojalitás is .
	kwic: képes akkorára tágítani szívünk ,
	kwic_new: képes akkorára tágítani szívünk ,
Original sent: Ebbõl az következik , hogy növekszik azoknak a száma , akik nem képesek törleszteni lakáshitelüket .
	kwic: nem képesek törleszteni lakáshitelüket
	kwic_new: akik nem képesek törleszteni lakáshitelüket
Original sent: Rogán Antal a forradalom napjaira utalva azt mondta : a magyarok bebizonyították maguknak és az egész világ elõtt , hogy képesek összefogni , egységként gondolkodni és cselekedni , megmutatták , hogy a jó ügyért az életüket is képesek feláldozni .
	kwic: hogy képesek összefogni , egységként
	kwic_new: hogy képesek összefogni , egységként gondolkodni
Original sent: De az EB megmutatta , hogy merõben új okok is képesek felszítani a szenvedélyeket és gerjeszteni az ellenségeskedést .
	kwic: is képesek felszítani a szenvedélyeket
	kwic_new: merõben okok is képesek felszítani a szenvedélyeket és
Original sent: Mára egyértelmûvé vált , hogy a géntechnológiára alapuló mezõgazdaság zsákutca , és nem képes megfelelni a jövõ kihívásainak .
	kwic: nem képes megfelelni a jövõ
	kwic_new: nem képes megfelelni a jövõ kihívásainak
Original sent: A reorganizációs feladatok mellett a kabinet minden forgatókönyvre felkészülve költségvetési átcsoportosítással megteremtette a pénzügyi fedezetet ahhoz , hogy a légitársaság egy esetleges , elkerülhetetlennek bizonyuló leállás napján és az azt követõ három napban képes legyen gondoskodni utasai célba juttatásáról .
	kwic: képes legyen gondoskodni utasai célba
	kwic_new: légitársaság napján képes legyen gondoskodni utasai célba juttatásáról
Original sent: A 24 éves Megan Fox és a 37 éves Brian Austin Green alig néhány hónapja mondta ki a boldogító igent , de a hírek szerint máris nehezen képesek elviselni egymást .
	kwic: nehezen képesek elviselni egymást
	kwic_new: szerint máris nehezen képesek elviselni egymást
Original sent: Gyakran még akkor sem , ha ügyelünk a megfelelõ mennyiség bevitelére , ugyanis arra már kevesebb gondot fordítunk , hogy vajon szervezetünk képes -e hasznosítani ezt a rendkívül értékes tápanyagot .
	kwic: képes -e hasznosítani ezt a
	kwic_new: vajon szervezetünk képes -e hasznosítani ezt a tápanyagot
Original sent: Az a gyõztes , aki legtovább képes bent maradni a kabinban .
	kwic: képes bent maradni a kabinban
	kwic_new: aki legtovább képes bent maradni a kabinban
Original sent: Ez utóbbi esetben a szoftver egy elõre meghatározott IRC szerverrel képes kommunikálni , és arról parancsokat fogadni .
	kwic: szerverrel képes kommunikálni , és
	kwic_new: esetben szoftver meghatározott IRC szerverrel képes kommunikálni , és fogadni
Original sent: A Drive eRazer többféle üzemmódban képes mûködni .
	kwic: üzemmódban képes mûködni
	kwic_new: többféle üzemmódban képes mûködni
Original sent: A megtévesztõ , tömegesen terjesztett , adathalászati célokat szolgáló elektronikus levelek küldözgetéséhez azonban a támadóknak sokszor nem fûlik a foguk , hiszen azokból rengeteget képesek kiszûrni az antispam termékek .
	kwic: rengeteget képesek kiszûrni az antispam
	kwic_new: azokból rengeteget képesek kiszûrni az antispam termékek
Original sent: Még az olyan operációs rendszerek is , mint a Microsoft Windows XP SP2 vagy az Apple OS X , melyek automatikusan képesek letölteni és telepíteni a frissítéseket , ki vannak téve ennek a " mini Y2K " problémának , hiszen számos felhasználó egyáltalán nem foglalkozik a frissítések elvégzésével .
	kwic: automatikusan képesek letölteni és telepíteni
	kwic_new: melyek automatikusan képesek letölteni és telepíteni frissítéseket ,
Original sent: A Mutafrog vírus egyszerû mûködése ellenére komoly károkat képes okozni .
	kwic: károkat képes okozni
	kwic_new: egyszerû ellenére komoly károkat képes okozni
Original sent: E programok létrehozói egyszerre emberek ezreit képesek átverni .
	kwic: ezreit képesek átverni
	kwic_new: egyszerre emberek ezreit képesek átverni
Original sent: A Larrabee a tervek szerint egy többmagos , GPGPU ( General-Purpose Computing on Graphics Processing Units ) grafikus chip lesz , amely a grafikai megjelenítésen túl egy hagyományos CPU feladatait is képes átvenni , illetve párhuzamos feldolgozást biztosít a hardver elõnyeit kihasználó alkalmazásoknak .
	kwic: is képes átvenni , illetve
	kwic_new: feladatait is képes átvenni , illetve párhuzamos
Original sent: A Business Productivity Online Suite rugalmasságának köszönhetõen mind a kis- és közép , mind a nagyvállalatok igényeit képes kielégíteni .
	kwic: igényeit képes kielégíteni
	kwic_new: rugalmasságának köszönhetõen kis- igényeit képes kielégíteni
Original sent: MELASZ-Ready 2.0 ? aláíró alkalmazással , ezáltal az alkalmazások egymás hitelesített dokumentumait értelmezni és kezelni is képesek .
	kwic: értelmezni és kezelni is képesek
	kwic_new: alkalmazással ezáltal dokumentumait értelmezni és kezelni is képesek
Original sent: Hátoldalán USB csatlakozó található , a mellékelt Edimax nyomtatószerver révén pedig Ethernet és Wi-Fi hálózatokhoz is képes csatlakozni .
	kwic: is képes csatlakozni
	kwic_new: Hátoldalán található is képes csatlakozni
Original sent: Az a rendszer ugyanis , mely képes felismerni a szokatlan rezgésmintákat , melyek károsíthatják a laptop merevlemezét , arra is alkalmas , hogy a földfelszín vibrálását érzékelje .
	kwic: mely képes felismerni a szokatlan
	kwic_new: mely képes felismerni a szokatlan rezgésmintákat ,
Original sent: Ahogy azt a Computexen kívüli Nvidia-bemutatókon kiderült , az Intel és AMD processzorokkal egyaránt remek teljesítményt nyújtó , két GeForce 7950 GX2-es egységet tartalmazó grafikus eszköz nagyfelbontású ( high resolution - HR ) megjelenítést tesz lehetõvé a PC-k számára , a 2560 × 1600-as felbontás csaknem moziszerû élményt képes nyújtani a felhasználóknak .
	kwic: élményt képes nyújtani a felhasználóknak
	kwic_new: a felbontás moziszerû élményt képes nyújtani a felhasználóknak
Original sent: Bármennyire is elképzelhetetlennek tûnik a történet , komoly veszélyforrást jelentenek a térségben tartózkodó szomáliai kalózok , képesek voltak megtámadni és kifosztani a saját országuk megsegítésére érkezõ segélyszállítmányt cipelõ hajót .
	kwic: képesek voltak megtámadni és kifosztani
	kwic_new: képesek voltak megtámadni és kifosztani cipelõ
Original sent: Még ma is érdemes egy próbát tenni vele , ha képesek vagyunk túllépni az elsõ generációs Unreal Engine által életre keltett grafika puritánságán .
	kwic: képesek vagyunk túllépni az elsõ
	kwic_new: képesek vagyunk túllépni az elsõ puritánságán
Original sent: A játék során Kirby képes alakot váltani , egyszer például autóvá változott .
	kwic: képes alakot váltani , egyszer
	kwic_new: során Kirby képes alakot váltani , egyszer változott
Original sent: A harcos Caddoc és az íjász E'lana azonban oly hatalmas fába vágja a fejszéjét , amekkorát talán még külsõ segítséggel sem lesznek képesek kidönteni .
	kwic: lesznek képesek kidönteni
	kwic_new: amekkorát talán még segítséggel sem lesznek képesek kidönteni
Original sent: A Cars ( verdák ) sikere már a múlté , a legtöbb filmes játékból - legyen szó animációs filmrõl , képregényfilmrõl , vagy bármilyen más típusú ihletforrásról - ma már csak akkor lehet több százezres , ritkább esetben milliós példányszámban eladni , ha a termék képes elszakadni a filmektõl , és önállóan is megáll a lábán . [ hirdetes ] Brian Farrell , a közelmúltban csõdrõl és egyéb szörnyûségekrõl vizionáló pletykákkal hadakozó kiadó feje megerõsítette , hogy a THQ nem szórja többé a fiatal korosztályt megcélzó licencekre a pénzt , hanem figyelmét és erõforrásait a kulcsfontosságú franchise-okra fordítja .
	kwic: termék képes elszakadni a filmektõl
	kwic_new: a termék képes elszakadni a filmektõl , és
Original sent: A Spybot 4WD katonai célokat ( is ) szolgál majd , ugyanis fegyvereket is képes hordozni és mûködtetni , így nem csak megvédeni képes magát azoktól , akik fülön csípnék mint otthoni játékszert , hanem akár támadó eszközként , vagy felderítõként is bevethetõ .
	kwic: nem csak megvédeni képes magát
	kwic_new: nem csak megvédeni képes magát azoktól , csípnék
Original sent: A hivatalos válasz rendkívül kiábrándítóra sikeredett , ugyanis a vállalat szerint csak az Evo 3D , és a Flyer képes megfelelni a felület hardveres követelményeinek , így még a Mobile World Congress-en bejelentett Desire/Incredible/Wildfire HD trióra sem fog megérkezni a GUI .
	kwic: Flyer képes megfelelni a felület
	kwic_new: szerint 3D a Flyer képes megfelelni a felület követelményeinek , így
Original sent: Az iPhone 4S kamerájával készült fotók megtekintéséhez kattintson a képre A változtatások listája három fõ elem köré csoportosul : egyrészt a készülék megkapta az iPad 2-ben is használt , kétmagos Apple A5 központi egységet , másrészt a HSDPA modeme 14,4 megabit/s sebességgel képes letölteni , harmadrészt pedig új kamera került a telefonba .
	kwic: sebességgel képes letölteni , harmadrészt
	kwic_new: másrészt modeme megabit/s sebességgel képes letölteni , harmadrészt került
Original sent: A Whited00r tulajdonképpen egy egyedi firmware , mely egész sok mindent képes átemelni az iOS 5 funkciói közül , azonban a fejlesztõk pár szolgáltatást nem voltak képesek imitálni .
	kwic: mindent képes átemelni az iOS
	kwic_new: Whited00r tulajdonképpen firmware mely egész sok mindent képes átemelni az iOS közül , azonban
Original sent: A DuraWrite , RAISE technológiákat és 128 bites AES hardveres titkosítást is támogató SSD tárhelye ugyan kicsi , azonban az operációs rendszeren és az alkalmazások sebességén sokat képes gyorsítani .
	kwic: sokat képes gyorsítani
	kwic_new: technológiákat tárhelye ugyan rendszeren sokat képes gyorsítani
Original sent: Ez a technológia képes megelõzni az olyan rosszindulatú támadások romboló hatásait , mint például a Zotob és az IRCBot .
	kwic: technológia képes megelõzni az olyan
	kwic_new: Ez a technológia képes megelõzni az olyan hatásait , mint
Original sent: Lejátsza az MP3 , WMA és DRM WMA formátumokat , utóbbi révén olyan zeneletöltõ szolgáltatókkal is képes együttmûködni , mint a Rhapsody , a Napster vagy a Yahoo !
	kwic: is képes együttmûködni , mint
	kwic_new: Lejátsza révén szolgáltatókkal is képes együttmûködni , mint Rhapsody
Original sent: A 480 vagy 576 soros DVD-filmeket a készülék feljavítja , megszûri a zajt , és a HDMI kimeneten keresztül továbbítja az ezt fogadni képes megjelenítõhöz .
	kwic: az ezt fogadni képes megjelenítõhöz
	kwic_new: az ezt fogadni képes megjelenítõhöz
Original sent: Megújult a Panda spamszûrõje is , amely a gyártó adatai alapján a kéretlen reklámlevelek 97 százalékát képes kiszûrni .
	kwic: százalékát képes kiszûrni
	kwic_new: amely alapján reklámlevelek 97 százalékát képes kiszûrni
Original sent: Telepítési lépések Ha sikeresen összeszedtük a Windows Virtual PC-t futtatni képes vasat , kezdõdjék a telepítés !
	kwic: Virtual PC-t futtatni képes vasat
	kwic_new: a Windows Virtual PC-t futtatni képes vasat
Original sent: 6. A DOSBox szerencsénkre rengeteg régi hangkártyát képes emulálni , így gyakorlatilag nem létezik olyan DOS-os program , amelybõl ne tudnánk hangot elõcsalni .
	kwic: hangkártyát képes emulálni , így
	kwic_new: 6. szerencsénkre rengeteg régi hangkártyát képes emulálni , így létezik
Original sent: A helyi lakosság tájékoztatására az Antenna Hungária Rt. nyíregyházi középhullámú adója /1251 MHz / tegnaptól 24 órában az MR helyi stúdiójának árvízi információs mûsorát sugározza , ezenkívül a cég fehérgyarmati tv-adójában 24 órás szolgálatot rendeltek el , hogy a környéken tevékenykedõ tévétársaságok a nap bármely órájában képesek legyenek bejátszani a legfrissebb híradásaikat . [ www.mobilforum.hu ]
	kwic: képesek legyenek bejátszani a legfrissebb
	kwic_new: tévétársaságok órájában képesek legyenek bejátszani a legfrissebb híradásaikat . www.mobilforum.hu
Original sent: 1979 szeptemberében Raskin engedélyt kapott , hogy munkatársakat toborozzon a projekthez , így olyan mérnököt keresett , aki képes összeállítani a prototípust .
	kwic: aki képes összeállítani a prototípust
	kwic_new: aki képes összeállítani a prototípust
Original sent: Az egyszervolt.hu online tévéje , a mese.tv ezzel párhuzamosan lecserélte - egyelõre még csak IE9-es aloldalán - a Flash alapú rendszerét , amely helyére a HTML5 került , s így beépített pluginek nélkül képes lejátszani az MP4 formátumú , H.264 kódolásban tömörített videókat .
	kwic: nélkül képes lejátszani az MP4
	kwic_new: pluginek nélkül képes lejátszani az MP4 videókat
Original sent: A januárban bemutatott új Core i5 és i7 modellek minden pozitív tulajdonságát örökli a vPro generáció is , vagyis többmagos felépítésûek , Hyper Threading-technológiát alkalmaznak a folyamatosabb feladatvégrehajtás érdekében , és Turbo Boost-technológiával képesek dinamikusan szabályozni teljesítményüket .
	kwic: képesek dinamikusan szabályozni teljesítményüket
	kwic_new: Boost-technológiával képesek dinamikusan szabályozni teljesítményüket
Original sent: A kormány " verje ki a fejébõl , hogy ismét esetlegesen a Közgép , vagy bármely más egyedi cég megbízásával a kérdést el tudja rendezni ! " - fogalmazott , arra figyelmeztetve : egy politikai döntéssel megbízott " házi cég " nem lesz képes kivitelezni az atomerõmû bõvítését .
	kwic: lesz képes kivitelezni az atomerõmû
	kwic_new: cég nem lesz képes kivitelezni az atomerõmû bõvítését
Original sent: A legtöbb távhõ cég azonban a két százalékos hasznot sem képes kitermelni , mert a hõ árát leszorítja a kormány , az áram piacon pedig a túlkínálat miatt jelenleg alacsony árak alakultak ki .
	kwic: sem képes kitermelni , mert
	kwic_new: cég azonban hasznot sem képes kitermelni , mert leszorítja
Original sent: A teljes piaci díjbevétel 54 százalékát kitevõ nem életbiztosítási bevételek mintegy két és fél milliárd forinttal csökkentek az egy évvel korábbihoz képest , amiben annak is komoly szerepe van , hogy ha a lakosság és a vállalatok megnövekedett költségeik , illetve rosszabbodó életkörülményeik miatt nem képesek kigazdálkodni a biztosítási díjat , elõször a biztosításról mondanak le .
	kwic: nem képesek kigazdálkodni a biztosítási
	kwic_new: miatt nem képesek kigazdálkodni a biztosítási díjat , mondanak
Original sent: A taxisok nem lesznek képesek árat emelni , mert forgalmuk is folyamatosan mérséklõdik .
	kwic: képesek árat emelni , mert
	kwic_new: képesek árat emelni , mert mérséklõdik
Original sent: " Meglepõ a mostani recessziót egyedülállónak tekintõ , korábbi tapasztalataikat hasznosítani nem képes válaszadók magas aránya .
	kwic: korábbi tapasztalataikat hasznosítani nem képes
	kwic_new: korábbi tapasztalataikat hasznosítani nem képes aránya
Original sent: A szocialista frakciót felháborítja , hogy az ellenzék még egy közlekedési dugót is képes kihasználni arra , hogy a törvényhozás munkáját akadályozza - közölte az Juhász Gábor frakcióvezetõ-helyettes .
	kwic: is képes kihasználni arra ,
	kwic_new: ellenzék még dugót is képes kihasználni arra , hogy
Original sent: Mintegy harminc laktanyát alakítottak át , ezekben körülbelül 30 ezer menekültet képesek elhelyezni .
	kwic: menekültet képesek elhelyezni
	kwic_new: ezekben ezer menekültet képesek elhelyezni
Original sent: Gordana Igric , a balkáni nyomozó újságíró hálózat belgrádi regionális igazgatója Magyarország példája kapcsán megjegyezte : látható , hogy az EU nem képes mit tenni azon tagállamaival , amelyeknél veszélybe kerül a sajtószabadság .
	kwic: képes mit tenni azon tagállamaival
	kwic_new: EU nem képes mit tenni azon tagállamaival , kerül
Original sent: A tajvani védelmi költségvetés tavaly csak mintegy tízmilliárd dollárra rúgott , de a korszerû , elsõsorban az Egyesült Államoktól beszerzett fegyverek révén Tajvan mégis képes fenntartani az erõegyensúlyt , talán felül is múlja Kínát .
	kwic: mégis képes fenntartani az erõegyensúlyt
	kwic_new: elsõsorban révén mégis képes fenntartani az erõegyensúlyt ,
Original sent: Ted Sator csapata pontveszteség nélkül várja a folytatást , és a kapitány szerint Ladányiék képesek lesznek megfelelni a magyar közönség elvárásainak .
	kwic: képesek lesznek megfelelni a magyar
	kwic_new: Ladányiék képesek lesznek megfelelni a magyar elvárásainak
Original sent: A szakemberek szerint a társas kapcsolatokban igény , hogy az ember érzékenyen reagáljon különbözõ helyzetekben a követelményekre ; képes legyen felmérni viselkedése hatását és következményét .
	kwic: képes legyen felmérni viselkedése hatását
	kwic_new: képes legyen felmérni viselkedése hatását és
