Original sent: Bánki Erik : - Szó sincs errõl , mi a gazdálkodás hatékonyságát szeretnénk javítani , és amirõl Ön is beszélt , megszûntetni azt a rendszert , hogy itt mindenki azért kapjon pénzt , hogy ott ücsörög kuratóriumban , ott ücsörög felügyelõbizottságban .
	kwic: hatékonyságát szeretnénk javítani , és
	kwic_new: mi gazdálkodás hatékonyságát szeretnénk javítani , és amirõl
Original sent: Székely Tamás egyészségügyi miniszter : - Az egészségbiztosításról szóló 2008. évi I. törvényt hatályon kívül szeretném helyezni , és azt állítom , és azt mondom , hogy a biztosítói funkciót meg kell erõsíteni , ezért aztán egy olyan tervezetet terjesztek szintén a kormány elé , ami a területi kiegyenlítés , és a népegészségügyi szempontok érvényesítésének irányába hat , az egészségbiztosítás forrásaival való gazdálkodást a szolgáltatás vásárlás felelõsségét , és szabadságát szeretném megteremteni .
	kwic: kívül szeretném helyezni , és
	kwic_new: miniszter törvényt hatályon kívül szeretném helyezni , és állítom
Original sent: H.R. : - Mi Védegylet szinten szeretjük ezt így venni , mert pontosan erre szeretnénk ráébreszteni az embereket , és itt van egy olyan dolog , amit még korábban szerettem volna mondani , hogy vajon miért nem aktívak itthon az állampolgárok , szerintem ennek nagyon sok köze van ahhoz a negyven évhez , amit itt megéltünk , amikor teljesen atomizálódott a társadalom , illetve kialakult azt hiszem egy szekpticizmus a politikával , tehát az általános értelemben vett politikával szemben , kialakult az emberekben egy passzívizmus is , és egy közöny .
	kwic: szerettem volna mondani , hogy
	kwic_new: amit korábban szerettem volna mondani , hogy , van
Original sent: Az emelkedõ üzemanyagárat a jövedéki adó egy részének visszaigénylésével szeretnék ellensúlyozni - mondta el ......
	kwic: visszaigénylésével szeretnék ellensúlyozni - mondta
	kwic_new: emelkedõ részének visszaigénylésével szeretnék ellensúlyozni - mondta el
Original sent: Mv : - Igen , természetesen úgy fogják lesz , aki úgy értelmezi majd , hogy Önök elõre vetítik , mondhatnám bíztatják azokat , akik családi adózást szeretnének bevezetni .
	kwic: adózást szeretnének bevezetni
	kwic_new: akik családi adózást szeretnének bevezetni
Original sent: Kérem , a hölgynek szeretnék segíteni , aki Öntõl kérdezte ezt a dolgot .
	kwic: hölgynek szeretnék segíteni , aki
	kwic_new: a hölgynek szeretnék segíteni , aki kérdezte
Original sent: " Az ötlet az én fejemben már régóta megfogalmazódott , ha nem is egészen konkrétan , hanem az igénye annak , hogy változtatni kell a harsányi oktatáson . " - mondja Szabó Gergely polgármester , a település pályázni szeretne az Ökoiskola címre , de sajnos sok szülõ elvitte eddig más települések iskoláiba a gyermekét , talán így vissza lehet õket csalogatnia .
	kwic: a település pályázni szeretne az
	kwic_new: a település pályázni szeretne az címre ,
Original sent: Ugye , hiszen amit Ön említ , ezt a baloldaliságot képviseli a mostani MSZP , vagy legalábbis szeretné képviselni , tehát az egy nagyon érdekes dolog .
	kwic: legalábbis szeretné képviselni , tehát
	kwic_new: legalábbis szeretné képviselni , tehát dolog
Original sent: A Lehet Más a Politika azt szeretné elérni , hogy a BTK-t évente csak egyszer lehessen módosítani , és a pénzbírságok összegét áldozatvédelemre kelljen fordítani .
	kwic: azt szeretné elérni , hogy
	kwic_new: Más azt szeretné elérni , hogy lehessen
Original sent: Mv : - Most ugye egyébként arról volt szó , hogy idén év végéig szeretnék megszerezni az engedélyeket , mit gondol , mekkora ennek a lehetõsége ?
	kwic: végéig szeretnék megszerezni az engedélyeket
	kwic_new: idén év végéig szeretnék megszerezni az engedélyeket , gondol
Original sent: Sipos Ildikó riporter : - Semjén Zsolt azt is tanácsolta , hogy azok , akik állampolgársági esküt szeretnének tenni , keressék fel a magyarországi hivatalokat , hazánk ugyanis nem ad ki állampolgársággal kapcsolatos adatokat .
	kwic: esküt szeretnének tenni , keressék
	kwic_new: azok , akik állampolgársági esküt szeretnének tenni , keressék fel hivatalokat , ad
Original sent: Addig vám és adómentes az üzemanyag , amíg bent van a tartályban és azt elhasználja az utas , amennyiben nem , itt már jogsértés van és ezért eljárást vezet be a Vám és Pénzügyõrség , azért azt hangsúlyozni szeretném , hogy az ellenõrzések nemcsak kifejezetten a határátkelõhelyen folynak , hiszen ha valaki csalni akar az üzemanyaggal és belterületen , eladja , lefejti , azért ezt is figyelik a Jövedéki hivatalok és a járõreink úgyhogy akkor is jogsértés történik , hogyha belterületen valaki mondjuk a saját ingatlanánál , vagy másik ingatlannál lefejti az üzemanyagot és megy vissza újra tankolni .
	kwic: azért azt hangsúlyozni szeretném ,
	kwic_new: azért azt hangsúlyozni szeretném , hogy
Original sent: Ugyanakkor azt kihangsúlyoznám , hogy nem az a célunk , hogy sokan beadják és ezáltal összedõljön az ellátórendszer , hanem az a célunk , hogy ezzel a megmozdulással , a kormányzat figyelmét az egészségügyben lévõ problémákra fordítsuk a figyelmüket , tehát ilyen értelemben az a célunk , hogy azt a drámai orvoselvándorlást , ami 2011-t is jellemzi , azt valamilyen módon megfékezzük , idén várhatóan 1200 orvos fogja elhagyni Magyarországot , látható , hogy ettõl spontán is egy-két éven belül összedõlne az ellátórendszer , ezt szeretnénk megelõzni és ezért indítottuk el ezt az akciónkat .
	kwic: ezt szeretnénk megelõzni és ezért
	kwic_new: ezt szeretnénk megelõzni és ezért indítottuk
Original sent: Nem ehhez szeretnék hozzászólni , hanem miután hozzáértõ emberek vannak és a kiadókhoz is köze van a jelenlévõknek egy olyan problémát vetnék fel hogy hosszú évek óta figyelem a tankönyveket és azt tapasztalom hogy ilyen-olyan címszó alatt jelentetnek meg tankönyveket és ezek a tankönyvek nincsenek átdolgozva , legtöbbször a képek vannak floppyn ide-oda tologatva , a cím esetleg a tartalomjegyzékben azt látjuk hogy át van stílusosan forgava a mondat vagy szó ami a tartalomjegyzékben a benne lévõ fejezetben , az anyag ugyanaz .
	kwic: ehhez szeretnék hozzászólni , hanem
	kwic_new: Nem ehhez szeretnék hozzászólni , hanem vetnék
Original sent: <hi rend="it"> Orbán Viktor </hi> aFidesz elnöke : - Mi nem kívánunk természetesen beleavatkozni az Erdélyben egymással versengõ felek tárgyalásaiba , de jelezni szeretnénk , hogy mi egy erõs Erdélyben vagyunk érdekeltek , ehhez pedig megállapodás kell , és bíztatom az erdélyi magyar feleket , hogy tegyen meg mindent azért , hogy a megállapodás létrejöjjön , és az erdélyi magyar közösség politikai képviseletének a súlya tovább erõsödjön .
	kwic: , de jelezni szeretnénk ,
	kwic_new: , de jelezni szeretnénk , hogy
Original sent: Teljesen igaza van , mi is azért vállaltuk ezt a feladatot , mert pontosan azt szeretnénk elkerülni , hogy ha megismétlõdne az , ami a központi területeken már most is zajlik .
	kwic: azt szeretnénk elkerülni , hogy
	kwic_new: pontosan azt szeretnénk elkerülni , hogy megismétlõdne
Original sent: K.E. : - Politológia szakot választottam , említettem már , hogy közgazdasággal foglalkozom , sajnos nem ez a szívem vágya , csak hát a körülöttünk lévõ világ , illetve térségünk anyagi problémái ránk is kihatottak úgy , hogy nekem maradt a közgazdságtan Szabadkán , viszont nagyon sok más minden érdekel és szeretnék nyitni más témák felé is , azért választottam a politológiát .
	kwic: és szeretnék nyitni más témák
	kwic_new: és szeretnék nyitni más témák felé is , választottam
Original sent: A legfrissebb hír ezzel kapcsolatban , hogy a hétvégéig 31oltópont kezdi el mûködését , a jövõ hétvégére ez akár 200-ra is nõhet ez a szám , így szeretnék felgyorsítani az új influenza elleni védekezést .
	kwic: így szeretnék felgyorsítani az új
	kwic_new: így szeretnék felgyorsítani az új védekezést
Original sent: A párt gazdasági kabinetjének vezetõje , Rogán Antal hozzáfûzte , hogy még a héten szeretnének tárgyalni , a tervezetet keményen bíráló bankszövetséggel is .
	kwic: héten szeretnének tárgyalni , a
	kwic_new: még a héten szeretnének tárgyalni , a bankszövetséggel
Original sent: Ezt a módszertani változást szeretnék végigvinni a jogszabályokon is .
	kwic: változást szeretnék végigvinni a jogszabályokon
	kwic_new: Ezt a módszertani változást szeretnék végigvinni a jogszabályokon is
Original sent: Ezt szeretné elmagyarázni a következõ hét hétben , tehát ezek voltak a fõ információk .
	kwic: Ezt szeretné elmagyarázni a következõ
	kwic_new: Ezt szeretné elmagyarázni a következõ hétben , tehát
Original sent: Szekeres Gerõ : - Az Islantic volt , amelyre be is fizettük a csúcsdíjat és a 19-bõl , 9-en szerettük volna megmászni , sajnos a mi erdélyi csapatunknak az egyik tagját ott kapta el ez a csúnya légúti vírusos fertõzés és 40 fokos láza volt a Hargitai Szabolcs kollegánknak és õ visszavonult , akkor mi maradtunk ketten a csíkszeredai kollégámmal és õ is azt mondta , hogy inkább lemegy az Anapunna táborba a többiekkel , én egymagamra maradtam és azt mondtam én is , hogy visszavonulok .
	kwic: szerettük volna megmászni , sajnos
	kwic_new: 9-en szerettük volna megmászni , sajnos kapta
Original sent: Meg kell céloznom azt a hölgyet is aki szeretne venni 3 ezer forintért egy nadrágot amibe jól érezhesse magát terhessége alatt , de természetesen meg kell céloznom azt a réteget is aki mondjuk egy bankban igazgatónõ .
	kwic: aki szeretne venni 3 ezer
	kwic_new: aki szeretne venni 3 ezer forintért nadrágot érezhesse
Original sent: Földesi Dorka , a HUMUSZ munkatársa : - Mi erre a kiállításra hét interaktív tablóval készültünk , ahol játékos formában szeretnénk megmutatni a látogatóknak , hogy mit tudnak tenni így a hétköznapjaikban a hulladékmegelõzés terén , illetve hát nemcsak hulladékkal , hanem energiával és vízzel is foglalkozunk a kiállításon .
	kwic: formában szeretnénk megmutatni a látogatóknak
	kwic_new: ahol játékos formában szeretnénk megmutatni a látogatóknak , hogy
Original sent: Répássy Róbert , igazságügyi államtitkár jelezte : a kormány mérlegelni szeretné az Országos Bírósági Hivatal és a legfõbb ügyész észrevételeit .
	kwic: a kormány mérlegelni szeretné az
	kwic_new: a kormány mérlegelni szeretné az észrevételeit
Original sent: És múzeummá szerették volna átalakítani , miután minden fából volt , minden kiszáradt , mint a zsír úgy égett el ez a malom a helyiek legnagyobb sajnálatára .
	kwic: szerették volna átalakítani , miután
	kwic_new: És múzeummá szerették volna átalakítani , miután volt
Original sent: Azt kell tudni , hogy én palack nélkül szerettem volna feljutni a csúcsra , és palack nélküli megmászásnak az egyik kritériuma sok más kritérium mellett , hogy nagyon alacsony szél kell hozzá .
	kwic: szerettem volna feljutni a csúcsra
	kwic_new: én nélkül szerettem volna feljutni a csúcsra , és kritériuma mellett , hogy
Original sent: Na , oda szeretnék kilyukadni , hogy elõször egyedül voltam ezzel , egészen januárig , Úgyhogy nem igazán számítottam olyan nagy , nem is volt nagy médiatámogatottságom .
	kwic: oda szeretnék kilyukadni , hogy
	kwic_new: Na , oda szeretnék kilyukadni , hogy voltam
Original sent: szeretnek elmeselni egy igaz tortenetet.itt tortent a kis falumban.anyukam szeretett volna venni a helyi gyogyszertarbol gyogyszereket , es nem adott a patikusno mert nem vagyunk allando vasarloi.egy patikus megtehet ilyet .
	kwic: szeretett volna venni a helyi
	kwic_new: falumban.anyukam szeretett volna venni a helyi gyogyszereket , adott
Original sent: Ez mindenkinek a saját élete , azzal közli az ember a másságát akivel szeretné tudatni .
	kwic: akivel szeretné tudatni
	kwic_new: akivel szeretné tudatni
Original sent: Szeretném felhívni azonban a figyelmeteket : mielõtt bármilyen gyógynövény kúrát tartósan vagy akár rövid ideig kipróbálnátok , tájékozódjatok több forrásból , könyvbõl , internetrõl , ismerõstõl , aki tényleg használta már .
	kwic: Szeretném felhívni azonban a
	kwic_new: Szeretném felhívni azonban a figyelmeteket : kipróbálnátok
Original sent: ; ) Itt szeretnénk bejelenteni , hogy a régi Betyár helyett egy új Betyár érkezett ( Laci ) Balázs mindenkinek nagyon köszön mindent !
	kwic: Itt szeretnénk bejelenteni , hogy
	kwic_new: Itt szeretnénk bejelenteni , hogy érkezett
Original sent: Szeretsz fõzni és jó is vagy a gasztronómiában .
	kwic: Szeretsz fõzni és jó
	kwic_new: Szeretsz fõzni és jó is vagy
Original sent: Akkor most konkrét példa nélkül : az önbíráskodók szeretnek úgy védekezni , ahogy Burcika és ismerõsei tették , bármilyen súlyos is legyen a tettük .
	kwic: szeretnek úgy védekezni , ahogy
	kwic_new: Akkor most nélkül önbíráskodók szeretnek úgy védekezni , ahogy tették
Original sent: Ez az , amit szeretett volna elérni ?
	kwic: szeretett volna elérni
	kwic_new: Ez az , amit szeretett volna elérni
Original sent: Nem bújhatok el , fájdalmam eltakarva , nem sírhatok szabadon a válladra borulva , ha találkozunk , a mosolyom szereted látni , keményen tanuljuk , mit jelent a szó : várni .
	kwic: mosolyom szereted látni , keményen
	kwic_new: ha a mosolyom szereted látni , keményen tanuljuk
Original sent: A kezdeményezés elsõ lépéseként indult a nyitottakvagyunk.hu honlap , azért hogy otthont adjon azoknak a közösségeknek , szervezeteknek , vállalatoknak , akik nyitottak , és ezt meg is szeretnék mutatni , abban bízva , hogy ezzel inspirálnak másokat is .
	kwic: is szeretnék mutatni , abban
	kwic_new: ezt meg is szeretnék mutatni , abban bízva , hogy
Original sent: 1D-s rajongóknak kötelezõ az oldal lájkolása , ha tudni szeretnének a friss hírekrõl !
	kwic: , ha tudni szeretnének a
	kwic_new: , ha tudni szeretnének a hírekrõl
Original sent: Hányszor szeretnénk megmagyarázni nekik : nem illik ez a Krisztus híveihez ! - de hiábavaló az igyekezetünk , nem hallgatnak ránk !
	kwic: Hányszor szeretnénk megmagyarázni nekik :
	kwic_new: Hányszor szeretnénk megmagyarázni nekik : illik de
Original sent: Távolról is szeretnék nézni az IP kamerák ...
	kwic: is szeretnék nézni az IP
	kwic_new: Távolról is szeretnék nézni az IP kamerák
Original sent: Továbbá érdeklõdnék , hogy nem szeretnének kibõvíteni a csatornakínálatot legalább a Super tv2-vel és az RTL2-vel ? mert már majd mindenkinél elérhetõ , de itt nem .
	kwic: nem szeretnének kibõvíteni a csatornakínálatot
	kwic_new: nem szeretnének kibõvíteni a csatornakínálatot tv2-vel ? mert
Original sent: Arról szeretnék érdeklõdni , hogy mikorra várhatjuk a telefont és utána a bekötést .
	kwic: Arról szeretnék érdeklõdni , hogy
	kwic_new: Arról szeretnék érdeklõdni , hogy várhatjuk
Original sent: Érdeklõdni szeretnék , hogy a DigiSport2 csatorna mikortól lesz elérhetõ önöknél is ?
	kwic: Érdeklõdni szeretnék ,
	kwic_new: Érdeklõdni szeretnék , hogy
Original sent: Szeretnék veled megosztani egy jó és egy rossz hírt .
	kwic: Szeretnék veled megosztani egy jó
	kwic_new: Szeretnék veled megosztani egy jó és hírt
Original sent: Ha viszont valaki mégis itt szeretné kiélni magát ... ebben az esetben a modik tudják a dolgukat .
	kwic: itt szeretné kiélni magát ...
	kwic_new: viszont valaki mégis itt szeretné kiélni magát ...
Original sent: Ha az eldobható mellett szeretnél váltani , íme egy újabb kalkuláció : Vegyük alapul , hogy eldobható pelenkát használsz és váltani szeretnél .
	kwic: használsz és váltani szeretnél
	kwic_new: pelenkát használsz és váltani szeretnél
Original sent: Alaplapi hibára tippelek , segítséget szeretnék kérni !
	kwic: segítséget szeretnék kérni
	kwic_new: segítséget szeretnék kérni
Original sent: Gondolom a szüleid sem kedvelnék ha arctalan valakik tegezõdve szeretnék leiskolázni .. a korodnál fogva !
	kwic: tegezõdve szeretnék leiskolázni .. a
	kwic_new: szüleid arctalan valakik tegezõdve szeretnék leiskolázni .. a
Original sent: Csak azért a pénzemért talán megfelelõ szolgáltatást szeretnék kapni .
	kwic: szolgáltatást szeretnék kapni
	kwic_new: pénzemért talán megfelelõ szolgáltatást szeretnék kapni
Original sent: köszönöm szépen a válaszokat a tegnapi problémára .... ( úgy látszik nem mindenki kaphat választ ) Most azt szeretném kérdezni , hogy lehet kérni kimenõ hívás korlátozásakor az elmaradt díjtartozásra részletfizetést ?
	kwic: azt szeretném kérdezni , hogy
	kwic_new: Most azt szeretném kérdezni , hogy lehet
Original sent: Én bizony nem nagyon csináltam érdemi munkát ma sem . persze tudom , hogy egy kertes házban mindig van mit csinálni , fõleg ha a megtermelt javakat nem szeretnénk hagyni hogy kárba menjen .
	kwic: nem szeretnénk hagyni hogy kárba
	kwic_new: fõleg javakat nem szeretnénk hagyni hogy kárba menjen
Original sent: Ha nem szeretné végképp kirobbantani a 3 .
	kwic: szeretné végképp kirobbantani a 3
	kwic_new: Ha nem szeretné végképp kirobbantani a 3
Original sent: helo szeretnék letölteni a telenor honlapjárol meg engeditek ?
	kwic: helo szeretnék letölteni a telenor
	kwic_new: helo szeretnék letölteni a telenor honlapjárol
Original sent: " Szeretném felhívni a kedves ügyfelek figyelmét arra , hogy amennyiben bankkártyával fizették ki ezt az utazásnak a díját , akkor lehetõségük van a bankjuk felé fordulni , hiszen itt egy meg nem valósult szolgáltatás történt és ezzel kapcsolatban kártérítésre jogosultak a bankjuktól is " - tette hozzá a a QBE biztosítótársaság vezérigazgatója .
	kwic: " Szeretném felhívni a kedves
	kwic_new: " Szeretném felhívni a kedves figyelmét , hogy
Original sent: Így kénytelen egyedül nekivágni a nagyvilágnak , ha nem szeretne unatkozni .
	kwic: nem szeretne unatkozni
	kwic_new: nem szeretne unatkozni
Original sent: A Dentinox gélt használjuk , de az csak pillanatnyi megoldást nyújt , a Nurofent pedig nem szeretném folyamatosan használni .
	kwic: szeretném folyamatosan használni
	kwic_new: Nurofent pedig nem szeretném folyamatosan használni
Original sent: El szeretném mondani , hogy szeretlek téged , eszemben vagy , bárhová is nézek .
	kwic: El szeretném mondani , hogy
	kwic_new: El szeretném mondani , hogy szeretlek
Original sent: Arról szeretnék érdeklõdni , hogy mikorra várhatjuk a telefont és utána a bekötést .
	kwic: Arról szeretnék érdeklõdni , hogy
	kwic_new: Arról szeretnék érdeklõdni , hogy várhatjuk
Original sent: Persze a hiba talán bennem van , mert még itt vagyok , és maradni szeretnék .
	kwic: , és maradni szeretnék
	kwic_new: , és maradni szeretnék
Original sent: Privát facebook üzenetét továbbítottuk kollégáinknak a megoldásig türelmet szeretnénk kérni .
	kwic: türelmet szeretnénk kérni
	kwic_new: megoldásig türelmet szeretnénk kérni
Original sent: A választ elõre is szeretném megköszönni :)
	kwic: is szeretném megköszönni
	kwic_new: választ elõre is szeretném megköszönni
Original sent: Ja , és annyit azért szeretnék Önöktõl kérni , hogy azért vizsgaidõszakokban , ne fejlesztgessük már a rendszert , mert jó érzékkel abban idõben csinálják !
	kwic: szeretnék Önöktõl kérni , hogy
	kwic_new: Ja , azért szeretnék Önöktõl kérni , hogy fejlesztgessük
Original sent: Holnap megyek a Telenorba ( Mammut ) , lehet náluk kapni ??
	kwic: lehet náluk kapni
	kwic_new: lehet náluk kapni
Original sent: - Nagyon szeretek hazajárni !
	kwic: Nagyon szeretek hazajárni
	kwic_new: - Nagyon szeretek hazajárni
Original sent: Helló , szeretnék érdeklõdni ha egy piros R betû jelenik meg a telefonom kijelzõjén akkor mit kell tenni hogy ne legyen ott és mit takar ez a jel ?
	kwic: , szeretnék érdeklõdni ha egy
	kwic_new: Helló , szeretnék érdeklõdni ha egy jelenik kell
Original sent: Privát facebook üzenetét továbbítottuk kollégáinknak a megoldásig türelmet szeretnénk kérni .
	kwic: türelmet szeretnénk kérni
	kwic_new: megoldásig türelmet szeretnénk kérni
Original sent: Szeretnénk elérni , hogy egyre többen tegyék közzé az utazások élményeitszimbolizáló fényképeket , kisebb videó felvételeket , bejegyzéseket .
	kwic: Szeretnénk elérni , hogy
	kwic_new: Szeretnénk elérni , hogy tegyék
Original sent: Nonszensz az egész felvetés is , kivéve , ha a kormányzati EU-ellenes szólamok tarthatatlanságára szeretne valaki rámutatni .
	kwic: szeretne valaki rámutatni
	kwic_new: tarthatatlanságára szeretne valaki rámutatni
Original sent: Érdeklõdni szeretnék hogy Huawei Ascend Y300-ra lesz -e elérhetõ android frissítés .
	kwic: Érdeklõdni szeretnék hogy
	kwic_new: Érdeklõdni szeretnék hogy lesz
Original sent: Jó Napot arra szeretnék választ kapni ha uj elõfizetõi szerzõdést szeretnék kötni és olyan telefont szeretnék kihozni aminek az elsõ törlesztõ részlete 0-ft ehez is kaukciót kérnek ?
	kwic: szerzõdést szeretnék kötni és olyan
	kwic_new: elõfizetõi szerzõdést szeretnék kötni és olyan szeretnék
Original sent: Ígéretünkhöz híven ezúton szeretnénk Benneteket tájékoztatni a Vodafonnal történt tárgyalásunk eredményérõl .
	kwic: szeretnénk Benneteket tájékoztatni a Vodafonnal
	kwic_new: Ígéretünkhöz híven ezúton szeretnénk Benneteket tájékoztatni a Vodafonnal eredményérõl
Original sent: Érdeklõdni szeretnék , hogy mi lehet az oka annak , hogy a múlt hónapban OTP-s ATM-nél megpróbáltam kifizetni a telefonszámlám , de a kipostázott számlához képest 6x akkora összeget vontak le .
	kwic: Érdeklõdni szeretnék ,
	kwic_new: Érdeklõdni szeretnék , hogy
Original sent: Kérdezni szeretnék , de ez nem tartozik senkire !
	kwic: Kérdezni szeretnék ,
	kwic_new: Kérdezni szeretnék , de
Original sent: Szeretnék érdeklõdni , hogy Önöknél mikor lesz elérhetõ az új Asus Nexus 7 ( 2013 ) ? : Egy cikk alapján úgy tûnik , hogy az USA T-mobile üzletekben már októberben kaphatóak lesznek , nyílván ez pár hónapot jelenthet számunkra , de azért jó lenne tudni mégis mikorra várható nagyjából .
	kwic: Szeretnék érdeklõdni , hogy
	kwic_new: Szeretnék érdeklõdni , hogy lesz
Original sent: A tegnapi nap folyamán szerettem volna vásárolni egy telefont az egyik üzletükben , mivel évek óta Édesanyám is Vodaoneos , én is , és havi jelleggel fizetünk a szolgáltatásokért , amiket igénybe veszünk , ezért úgy gondoltam , hogy ez a szolgáltató megfelel nekem , remek havidíjjal , 4990ft-os elõfizetéses telefonnal .
	kwic: szerettem volna vásárolni egy telefont
	kwic_new: folyamán szerettem volna vásárolni egy telefont üzletükben , mivel , és
Original sent: Csupán jelezni szeretném , hogy jelen idõpontban is hibásan mûködik a honlap , személyes adatok lekérésénél/megtekintésénél apró , fekete keretben az újratölt ( reload ) üzenet jelenik meg , azonban ezt megkísérelve a rendszer visszairányít a személyes adatok kiindulási felületére .
	kwic: Csupán jelezni szeretném ,
	kwic_new: Csupán jelezni szeretném , hogy
Original sent: Vezetni szeretne mindenki , arra az útra terelni az eseményeket , amelyet helyesnek lát , ennek köszönhetõen azonban csak eltávolodnak egymástól .
	kwic: Vezetni szeretne mindenki
	kwic_new: Vezetni szeretne mindenki , terelni , lát
Original sent: Szia Erzsébet , kérdésed továbbítottuk illetékes csoportunk felé , válaszukig kis türelmed szeretnénk kérni .
	kwic: türelmed szeretnénk kérni
	kwic_new: válaszukig kis türelmed szeretnénk kérni
Original sent: Az pedig szándékos félremagyarázása a javaslatnak , hogy a közintézményekben tárolt kincseinket gazdag magánszemélyeknek szeretnénk átjátszani .
	kwic: magánszemélyeknek szeretnénk átjátszani
	kwic_new: pedig kincseinket gazdag magánszemélyeknek szeretnénk átjátszani
Original sent: Ha egy nagyobb tárgyat minden oldalról látni szeretnénk , körbe kell járnunk , sok virág szirmai valamilyen körhöz hasonlatos formát szoktak alkotni , a Hold és a Nap is kör alakú , sõt az égitestek még félkör alakban is mozognak az égbolton .
	kwic: minden oldalról látni szeretnénk ,
	kwic_new: tárgyat minden oldalról látni szeretnénk ,
Original sent: Szeretnék érdeklõdni mikor várható önöknél LG G2 ?
	kwic: Szeretnék érdeklõdni mikor várható
	kwic_new: Szeretnék érdeklõdni mikor várható G2
Original sent: Szia Gyula , ha flottás elõfizetésed van , érdemes a kapcsolattartódnak jelezned , hogy készüléket szeretnél venni .
	kwic: készüléket szeretnél venni
	kwic_new: készüléket szeretnél venni
Original sent: Az igazat megvallva , nem szeretek különcködni .
	kwic: nem szeretek különcködni
	kwic_new: igazat megvallva , nem szeretek különcködni
Original sent: Éhen mégsem dögölhetnek , és ha már itthon maradtak ( egyelõre ) , szeretnék elérni , hogy nem fillérekért robotolnak ezerszer annyit ... , mint az Igazságos Mutyis király udvartartása ...
