Original sent: Szeretnénk emlékeztetni arra , hogy az elmúlt idõszakban a nyugdíjemelés a mindenkori infláció fölötti volt .
	kwic: Szeretnénk emlékeztetni arra ,
	kwic_new: Szeretnénk emlékeztetni arra , hogy
Original sent: Uraim , én nem tudom , ez a második megjegyzés , amit szeretnék tenni : ezt a Házat azért hívják a politika házának , hogy ha valaki feláll , szimpatikusat mond , és nem ért valamihez , vagy nincs tartalma , ezt el lehet adni , mert a televízió közvetíti ?
	kwic: amit szeretnék tenni : ezt
	kwic_new: amit szeretnék tenni : ezt hívják
Original sent: Még egy-két dolgot szeretnék említeni azzal kapcsolatban , amit az elõbb nem volt idõm elmondani , és amire az államtitkár úr is részben utalt .
	kwic: dolgot szeretnék említeni azzal kapcsolatban
	kwic_new: egy-két dolgot szeretnék említeni azzal kapcsolatban , volt
Original sent: Még egy fél pillanat türelmüket szeretném kérni !
	kwic: türelmüket szeretném kérni
	kwic_new: Még pillanat türelmüket szeretném kérni
Original sent: Azt szeretném kérni , hogy a módosító indítványok beadásának határidejét a mai nap végéig legyen szíves kiterjeszteni , hiszen tudomásom van arról , hogy még néhány módosító indítványt szeretnének beadni .
	kwic: Azt szeretném kérni , hogy
	kwic_new: Azt szeretném kérni , hogy legyen
Original sent: Szeretném felhívni a figyelmét , ha erre még 30-40 ezer fõt szükségszerûen rá kellene telepíteni , milyen katasztrófahelyzetet idézne elõ .
	kwic: Szeretném felhívni a figyelmét
	kwic_new: Szeretném felhívni a figyelmét , ha
Original sent: Szeretném jelezni , és természetesen a részletes vitában konkrétabban kifejteni , hogy részünkrõl is szükséges néhány érdemi változtatás megkísérlése ebben az áfatörvény-módosításban .
	kwic: Szeretném jelezni , és
	kwic_new: Szeretném jelezni , és kifejteni
Original sent: Néhány adattal szeretném alátámasztani a véleményemet , és megint csak visszautalnék - mint ahogy annak idején a büntetõjogi szabályozás változásának általános és részletes vitájában is tettem - arra a hatástanulmányra , amelyet még Deutsch Tamás ifjúsági és sportminiszter úr rendelt meg , és amely hatástanulmány 2001 végén készült el , 2002 elején került ki a nyilvánosság elé .
	kwic: adattal szeretném alátámasztani a véleményemet
	kwic_new: Néhány adattal szeretném alátámasztani a véleményemet , és
Original sent: Tehát önmagukkal lehet , hogy a nyáron jól fognak vitatkozni , sok sikert hozzá , mi érdemi kérdésekrõl szeretnénk szólni .
	kwic: kérdésekrõl szeretnénk szólni
	kwic_new: sikert , mi érdemi kérdésekrõl szeretnénk szólni
Original sent: A PPP lehetõvé teszi azt , hogy 15 , illetve 10 milliárd forintos nagyságrendben a magánszféra beruházzon erre a területre , de nagyon szeretném hangsúlyozni azt , hogy nem magánbörtönökrõl van szó , ahogy azt sokan szeretik a közvélemény elõtt hangoztatni , hanem az alapvetõ funkciókat változatlanul állami kézben tartó programról ; az õrzés , a szállítás , a nevelés , a nyilvántartás pontosan ugyanúgy állami feladat marad , mint korábban volt .
	kwic: nagyon szeretném hangsúlyozni azt ,
	kwic_new: nagyon szeretném hangsúlyozni azt , hogy
Original sent: A munkanélküliségrõl akkor még egyet ; ha már a bekiabáló nem ismeri a statisztikát , akkor szeretném elmondani ( Közbeszólások . ) , hogy minden létezõ összevetésben nõtt a foglalkoztatás : ha a három évvel ezelõttit nézem , 41 ezer fõvel , ha az év elejit nézem , 39 ezer fõvel , ha az elmúlt egy évit nézem , csaknem 10 ezerrel .
	kwic: akkor szeretném elmondani ( Közbeszólások
	kwic_new: egyet ha akkor szeretném elmondani ( Közbeszólások . ) , hogy
Original sent: És én ezt nem akarom tovább ragozni , csak szeretném újból azt a példát elmondani , hogy ha én bérbe adok egy lakást , a magántulajdonomat , akkor szeretném tudni , hogy ki lakik benne , szeretném tudni , hogy használják -e a lakást , szeretném tudni , hogy rendeltetésszerûen használják -e a lakást , hányan vannak benne , esetleg nem folytatnak -e benne olyan tevékenységet , ami nem a rendeltetésszerû lakáshasználathoz kapcsolódik .
	kwic: , szeretném tudni , hogy
	kwic_new: , szeretném tudni , hogy használják szeretném
Original sent: Azt szeretném hangsúlyozni , hogy csak abból a tevékenységbõl származó bevételre alkalmazható , amit a törvény egyértelmûen rögzít .
	kwic: Azt szeretném hangsúlyozni , hogy
	kwic_new: Azt szeretném hangsúlyozni , hogy alkalmazható
Original sent: Szeretném hangsúlyozni , hogy természetesen minden út leaszfaltozására nem jut pénz .
	kwic: Szeretném hangsúlyozni , hogy
	kwic_new: Szeretném hangsúlyozni , hogy jut
Original sent: Itt különösen három képviselõtársamat szeretném kiemelni , mert nagy élvezettel hallgattam az elemzésüket .
	kwic: képviselõtársamat szeretném kiemelni , mert
	kwic_new: Itt különösen három képviselõtársamat szeretném kiemelni , mert hallgattam
Original sent: Elnök úr intelmeit is figyelembe véve - még 30 , illetve most már csak 24 másodpercem van - röviden annyit szeretnék mondani , hogy a Magyar Demokrata Fórum részérõl támogatni fogjuk ezt a törvényjavaslatot , mert ez egy jó irányban tett jó lépés , ugyanakkor azt gondoljuk , hogy tovább kell folytatni ezt a szakaszt , hiszen a végsõ cél az , hogy a kerületi önkormányzatok akár évekre elõretekintve is kiszámítható bevételi forrásként tudják kezelni a forrásmegosztásból származó jövedelmet .
	kwic: annyit szeretnék mondani , hogy
	kwic_new: intelmeit 30 röviden annyit szeretnék mondani , hogy fogjuk
Original sent: Külön szeretném kiemelni , hogy az elmúlt évek intézkedési terveitõl
	kwic: Külön szeretném kiemelni , hogy
	kwic_new: Külön szeretném kiemelni , hogy terveitõl
Original sent: asszonynak , szeretném tájékoztatni a képviselõtársaimat , hogy a
	kwic: , szeretném tájékoztatni a képviselõtársaimat
	kwic_new: asszonynak , szeretném tájékoztatni a képviselõtársaimat , hogy
Original sent: keresztül belgyógyászként praktizáló orvos szeretném elmondani a
	kwic: orvos szeretném elmondani
	kwic_new: keresztül praktizáló orvos szeretném elmondani a
Original sent: Itt azt szeretném hangsúlyozni , hogy ingatlanadót
	kwic: azt szeretném hangsúlyozni , hogy
	kwic_new: Itt azt szeretném hangsúlyozni , hogy ingatlanadót
Original sent: eloszlatni .
	kwic: eloszlatni
	kwic_new: eloszlatni
Original sent: távhõtermelést szeretném külön kiemelni .
	kwic: szeretném külön kiemelni
	kwic_new: távhõtermelést szeretném külön kiemelni
Original sent: vagy 610. módosító javaslatokkal kapcsolatban szeretném mondani , hogy
	kwic: kapcsolatban szeretném mondani ,
	kwic_new: javaslatokkal kapcsolatban szeretném mondani , hogy
Original sent: Itt szeretnék reagálni egy elõzõ hozzászólásra , hogy a
	kwic: Itt szeretnék reagálni egy elõzõ
	kwic_new: Itt szeretnék reagálni egy elõzõ hozzászólásra , hogy
Original sent: Tehát nagyon szeretném tisztázni , hogy akkor , amikor fellazult a tervgazdaság és már az 1988-as években megalakultak az egyszemélyes részvénytársaságok és megkezdõdött annak a vagyonnak a kimentése , amelyet ez a társadalom hozott létre - részben úgy , hogy elvette a tulajdonostól , részben úgy , hogy 40-50 év alatt alkotott új értékeket -, s amelyek privatizálás névszó alatt sajnálatos módon nagy részben idegen tulajdonba kerültek , nem az eredeti tulajdonosokhoz kerültek és mégsincs ebbõl a sok-sok milliárdból a költségvetésnek semmiféle bevétele .
	kwic: nagyon szeretném tisztázni , hogy
	kwic_new: Tehát nagyon szeretném tisztázni , hogy akkor , fellazult
Original sent: Ugyanakkor hangsúlyozni szeretnénk , hogy ezt a módosítást jelentõs elemzések , tapasztalatok , számítások támasztják alá .
	kwic: Ugyanakkor hangsúlyozni szeretnénk ,
	kwic_new: Ugyanakkor hangsúlyozni szeretnénk , hogy
Original sent: Mindenekelõtt szeretném leszögezni , hogy az Alkotmánybíróság eddigi döntései teljesen világosan nem érintették a rászorultsági alapon való családi támogatás rendszerét , tehát ennek az alapelve fenntartható , alkalmazható az Alkotmánybíróság véleménye szerint is .
	kwic: Mindenekelõtt szeretném leszögezni , hogy
	kwic_new: Mindenekelõtt szeretném leszögezni , hogy érintették tehát
Original sent: Részben Sepsey Tamás már elmondta azokat az észrevételeket vagy az észrevételek egy részét , amit én is Hegyi Gyula képviselõtársam felszólalására szerettem volna elmondani .
	kwic: szerettem volna elmondani
	kwic_new: amit én felszólalására szerettem volna elmondani
Original sent: Ezen túlmenõen pedig föl szeretném hívni majd a figyelmet még egy olyan pontra , amirõl az elõttem szóló nem beszélt , de amit a magam részérõl rendkívül aggályosnak tartok .
	kwic: föl szeretném hívni majd a
	kwic_new: túlmenõen pedig föl szeretném hívni majd a figyelmet még pontra , beszélt
Original sent: Szeretném viszont kérni a kormányt , hogy ilyen módon ne próbálja ezt a kérdést kezelni , mert kezelhetetlen .
	kwic: Szeretném viszont kérni a kormányt
	kwic_new: Szeretném viszont kérni a kormányt , hogy
Original sent: Az államtitkár úr azt mondta , hogy az Igazságügyi Minisztérium úgy gondolja , hogy elég a bûncselekményeknél a jelenlegi felsõ határ , és hogy szeretnének ugyan a bírói gyakorlat bizonyos fajta súlyosítása irányába hatni , de ezt nem a felsõ határ emelésével , hanem az alsó határ emelésével és az enyhítõ szakasz alkalmazásának - bizonyos esetekben való - kizárásával szeretnék elérni .
	kwic: kizárásával szeretnék elérni
	kwic_new: ezt emelésével alkalmazásának való kizárásával szeretnék elérni
Original sent: Következõkben , lévén csak két perc áll rendelkezésekre , mindazon kérdésekre válaszolni , amit a képviselõ úr feltett , szeretném elmondani , hogy december 3-án az elsõfokú hatóság kötelezést adott ki a Budapesti Vegyimûveknek a szennyezõ anyagok levegõn keresztül történõ kiterjedésének megakadályozására december 20-ai határidõvel , és december 10-ei határidõvel a talajon keresztül történõ szennyezõ anyagterjedés megakadályozásának a terveit kell benyújtaniuk - és amit be is nyújtottak -, és március 31-éig kell ezt befejezni .
	kwic: , szeretném elmondani , hogy
	kwic_new: , szeretném elmondani , hogy adott
Original sent: Szeretném ismételten leszögezni : az elrendelt vizsgálat után a kormány úgy döntött a 1129/1995. kormányhatározata 6. pontjában , hogy a kormány felhívja a Miniszterelnöki Hivatalt , hogy a vizsgálat anyagait ...
	kwic: Szeretném ismételten leszögezni : az
	kwic_new: Szeretném ismételten leszögezni : az döntött
Original sent: Minden olyan törvénymódosítást , amely a privatizáció jelenleg kialakult folyamatának sikeres végrehajtását elõsegíti , azt egyértelmûen támogatni szeretnénk és támogatni fogjuk .
	kwic: szeretnénk és támogatni fogjuk
	kwic_new: törvénymódosítást , elõsegíti támogatni szeretnénk és támogatni fogjuk
Original sent: Úgy gondolom , a munkaadók is a tisztességes munkát , a tisztességes adózást választják , és a lelkiismeretüket szeretnék tisztának tudni akkor , amikor embereket alkalmaznak .
	kwic: szeretnék tisztának tudni akkor ,
	kwic_new: lelkiismeretüket szeretnék tisztának tudni akkor , alkalmaznak
Original sent: Napirend utáni hozzászólásommal azt is demonstrálni szerettem volna , hogy nem csak az ellenzéknek , illetve a magukat népnemzetinek pártoknak lehet nemzeti öntudata .
	kwic: azt is demonstrálni szerettem volna
	kwic_new: hozzászólásommal azt is demonstrálni szerettem volna , hogy
Original sent: Szeretném önöket emlékeztetni arra , hogy ezzel a korlátozással , mármint hogy magyar magánszemélyek földjüket külföldieknek nem adhatják el , eddig önök is egyetértettek , hiszen az elmúlt három évben nem tettek indítványt arra nézve , hogy ezt az állapotot számoljuk föl .
	kwic: Szeretném önöket emlékeztetni arra ,
	kwic_new: Szeretném önöket emlékeztetni arra , hogy
Original sent: Az államtitkár asszonynak szeretném megköszönni azt a kiegészítést , amelyet az elhangzott beszédhez tett .
	kwic: asszonynak szeretném megköszönni azt a
	kwic_new: Az államtitkár asszonynak szeretném megköszönni azt a kiegészítést , tett
Original sent: Szeretném kiemelni , és itt a parlament nyilvánossága és a közvélemény elõtt is elmondani , hogy az igazságszolgáltatási reform végrehajtásához az eddigiekben a kormány minden feltételt biztosított : a pénzügyi , a szervezeti , a személyi feltételeket is .
	kwic: Szeretném kiemelni , és
	kwic_new: Szeretném kiemelni , és elmondani
Original sent: 1848-cal kapcsolatban az Amerikai Egyesült Államok elnöke , Clinton üzenetet küldött , amelyben megdicsérte - szeretném hangsúlyozni - azokat , akik az ország függetlenségéért és a nép szabadságáért harcoltak .
	kwic: - szeretném hangsúlyozni - azokat
	kwic_new: - szeretném hangsúlyozni - azokat , harcoltak
Original sent: Csak szeretném tájékoztatni a képviselõtársakat - kiegészítendõ az államtitkár úr válaszát - az Erkel képviselõ úr által föltett kérdéssel kapcsolatban , ami nagy derültséget váltott ki a kormánypárti képviselõk között , miszerint a Mérleg utca baráti köre lenne a frankfurti könyvvásár preferáltja , hogy a lista egyebek között a következõ személyekbõl áll : Szabó Magda , Tandori Dezsõ , József Attila , Karinthy Frigyes , Kosztolányi Dezsõ , Krúdy Gyula , Mándy Iván , Márai Sándor , Nemes Nagy Ágnes , Ottlik Géza , Pilinszky János , Radnóti Miklós , Csoóri Sándor - és másokat is lehetne sorolni .
	kwic: Csak szeretném tájékoztatni a képviselõtársakat
	kwic_new: Csak szeretném tájékoztatni a képviselõtársakat föltett
Original sent: ELNÖK : Képviselõ úr , remélhetõleg nem interpellációt szeretett volna benyújtani , mert majdnem három percet beszélt .
	kwic: szeretett volna benyújtani , mert
	kwic_new: ELNÖK remélhetõleg interpellációt szeretett volna benyújtani , mert beszélt
Original sent: A késõbbiekben hosszabb hozzászólásra is készülök , röviden azonban szeretnék reagálni arra , ami a vezérszónoki körben - amikor még nem lehetett kétpercest kérni - részben elhangzott a miniszter úrtól és Gyuricza államtitkár úrtól , részint pedig nem hangzott el .
	kwic: azonban szeretnék reagálni arra ,
	kwic_new: röviden azonban szeretnék reagálni arra , elhangzott
Original sent: Ennek ellenére szeretném megkérdezni a következõket .
	kwic: ellenére szeretném megkérdezni a következõket
	kwic_new: Ennek ellenére szeretném megkérdezni a következõket
Original sent: Ugyanezt szeretném elmondani T. Asztalos Ildikó képviselõtársamnak is .
	kwic: Ugyanezt szeretném elmondani T. Asztalos
	kwic_new: Ugyanezt szeretném elmondani T. Asztalos képviselõtársamnak
Original sent: Aki legalább eljut odáig , arra a szintre , hogy telephelyet szeretne építeni , nem fog tudni .
	kwic: telephelyet szeretne építeni , nem
	kwic_new: telephelyet szeretne építeni , nem
Original sent: Mindezek a tulajdonképpen formainak tûnõ törvénysértések együttesen tökéletesen kiadják azt a végeredményt , amelynek az összes hátrányát elszenvedik az agrárgazdaság szereplõi , nevezetesen , hogy éppen - az Agrárgazdasági Tanács összesített megállapítását szeretném idézni - " Összességében nem teljesíthetõek a törvényben elõírt fõbb , jövedelempozíciót javító célkitûzések , folytatódik , és megfelelõ intézkedések hiányában felgyorsul az ágazat lemaradása , és ez végsõ soron azt eredményezi , hogy a magyar agrárgazdálkodók egy esetlegesen közeli uniós csatlakozás legfõbb vesztesei lesznek .
	kwic: megállapítását szeretném idézni - "
	kwic_new: - Tanács összesített megállapítását szeretném idézni - "
Original sent: Korábban Robert Fico szlovák miniszterelnök azt nyilatkozta : Szlovákiának érdeke , hogy területén széles nyomtávú vasút épüljön , ezért szeretne belépni a tervezett orosz-ukrán-osztrák közös vállalatba .
	kwic: ezért szeretne belépni a tervezett
	kwic_new: ezért szeretne belépni a tervezett vállalatba
Original sent: Szlovákiában a szlovák pártok közül a Kereszténydemokrata Mozgalom , a Szlovák Kereszténydemokrata Unió - Demokrata Párt , a Szlovák Nemzeti Párt szereti kihangsúlyozni keresztényi mivoltát , míg az egyetlen magyar párt , a Magyar Koalíció Pártja , amelynek tagsága erõsen konzervatív és keresztény-keresztyén felekezetû , szintén vállalja a vallásos világnézetet politikájában is .
	kwic: Párt szereti kihangsúlyozni keresztényi mivoltát
	kwic_new: Szlovákiában Mozgalom a Szlovák Nemzeti Párt szereti kihangsúlyozni keresztényi mivoltát , párt vállalja
Original sent: Második besorolást kapott a bejeiek pályázata , akik kétezer eurós hozzájárulást szeretnének kapni a templomuk tetõzetének rendbetételére .
	kwic: hozzájárulást szeretnének kapni a templomuk
	kwic_new: akik eurós hozzájárulást szeretnének kapni a templomuk rendbetételére
Original sent: Galló Istvánné , a PSZ elnöke közölte , a demonstrációval szeretnék kikényszeríteni , hogy a döntéseket az érdekvédelmi szervezetek véleményének kikérésével hozzák meg , mert a NEFMI eddig érdemi tárgyalásokat nem folytatott velünk .
	kwic: demonstrációval szeretnék kikényszeríteni , hogy
	kwic_new: a demonstrációval szeretnék kikényszeríteni , hogy hozzák
Original sent: &lt;&lt; Amikor már nagyon kötekedett meg lökdösött , egyszerûen muszáj volt leordítanom a fejét , hogy én megértem , mi a baja az életével , de õ is értse meg , hogy a gyerekei tényleg szeretnek ide járni .
	kwic: szeretnek ide járni
	kwic_new: gyerekei tényleg szeretnek ide járni
Original sent: Beszélni szeretnék vele .
	kwic: Beszélni szeretnék vele
	kwic_new: Beszélni szeretnék vele
Original sent: Ehhez azonban hozzátette , hogy &ldquo;amennyiben a korábbi ülések döntéseit is szeretnénk áttekinteni , úgy azt a városi könyvtárban találhatjuk meg . &rdquo;
	kwic: is szeretnénk áttekinteni , úgy
	kwic_new: &ldquo;amennyiben döntéseit is szeretnénk áttekinteni , úgy találhatjuk
Original sent: Az elsõ nap a Hegyalján persze nem csak azoknak tartogat izgalmakat , akik fürdõruhás lányokban vagy izmos férfi felsõtestekben szeretnének gyönyörködni a Tisza-parton , hanem azoknak is , akik egyedülálló zenei különlegességekre éhesek .
	kwic: felsõtestekben szeretnének gyönyörködni a Tisza-parton
	kwic_new: akik lányokban férfi felsõtestekben szeretnének gyönyörködni a Tisza-parton ,
Original sent: Pedig igyekszem a humor oldaláról megközelíteni , de azért be kell látnom , hogy nem megy a végtelenségig " &ndash; mondta el Nacsa Olivér , aki szeretné végre legyõzni betegségét , de úgy érzi , egyedül nem megy .
	kwic: szeretné végre legyõzni betegségét ,
	kwic_new: aki szeretné végre legyõzni betegségét , de
Original sent: Az Európai Parlament el szeretné érni , hogy módosuljon a dalszerzõknek és zenészeknek járó online szerzõi jogdíjak kifizetésének módszere .
	kwic: el szeretné érni , hogy
	kwic_new: Parlament el szeretné érni , hogy módosuljon
Original sent: Nagyon-nagyon tombol manapság a retro-gaming láz - talán a rengeteg flash játéknak is köszönhetõ , hogy ma lassacskán ugyanolyan népszerûek kezdenek lenni a régi Nintendo , Sega , Commodore stb. játékok , mint a saját korszakukban voltak . [ hirdetes ] Ezt a divathullámot szeretné meglovagolni az Innex nevû cég , amely visszahozza a köztudatba a Nomad-ot , a Sega egykori hordozható játékgépét .
	kwic: divathullámot szeretné meglovagolni az Innex
	kwic_new: hirdetes Ezt a divathullámot szeretné meglovagolni az Innex cég , visszahozza
Original sent: Az alábbi két új szezonális öcsívmentet szeretném bejelenteni : Boncsad , tõccsed ( +350 pont ) Töltsd le az Internet Explorer 8-at 2010. május 30-ig a letoltes.pcworld.hu-ról , miközben egy másik böngészõablakban be vagy jelentkezve a GSO-ra ( cookie-k engedélyezése ajánlott ) [ hirdetes ] Nyolc a magyar igazság ( +300 pont ) Lépj be az oldalra , és kommentelj legalább egy hírt minden egyes nap öt bármelyik napon 2010. március 9. és 2010. április 30 között a GSO-n , miközben Internet Explorer 8 böngészõt használsz .
	kwic: öcsívmentet szeretném bejelenteni : Boncsad
	kwic_new: Az alábbi két új szezonális öcsívmentet szeretném bejelenteni : Boncsad , tõccsed Töltsd
Original sent: A Splinter Cell : Conviction-t rendkívül sokan kedvelték az akció irányába történõ ellépésével , de Raymondék szeretnének visszahozni a régmúltból egy bizonyos kihagyhatatlan , plusz elemet is .
	kwic: Raymondék szeretnének visszahozni a régmúltból
	kwic_new: Raymondék szeretnének visszahozni a régmúltból elemet
Original sent: Muzyka ezek után egy új vállalkozásba szeretne kezdeni , egy teljesen más területen , ami elsõ látásra ijesztõnek tûnhet , de egyben izgalmas is az út , ami a megvalósítás felé vezeti õt .
	kwic: vállalkozásba szeretne kezdeni , egy
	kwic_new: Muzyka után egy új vállalkozásba szeretne kezdeni , egy területen , ijesztõnek
Original sent: A Samsung az idei évben kétszer annyit szeretne eladni okosmobiljaiból , mint tavaly .
	kwic: annyit szeretne eladni okosmobiljaiból ,
	kwic_new: Samsung évben kétszer annyit szeretne eladni okosmobiljaiból , mint
Original sent: A Pannon Navigátor ideális útitárs mindazoknak , akik sokat utaznak akár munkájuk miatt , akár mert szabadidejükben szeretnek világot látni - autóval és gyalogosan egyaránt .
	kwic: szeretnek világot látni - autóval
	kwic_new: szabadidejükben szeretnek világot látni - autóval és egyaránt
Original sent: A MacBook Pro tökéletes választás lehet azoknak az embereknek , akik egy kicsit többet szeretnénk vele csinálni , mint az átlagos felhasználók , de ugyanakkor szeretnék , ha hordozható lenne .
	kwic: szeretnénk vele csinálni , mint
	kwic_new: akik kicsit többet szeretnénk vele csinálni , mint felhasználók , de
Original sent: Ha hirdetni szeretnénk , nem kell más tenni , csak regisztrálni az www.etarget.hu oldalon , a formanyomtatvány kitöltése után 10 000 forinttal feltölteni virtuális számlánkat , és megadni a hirdetési paramétereket .
	kwic: Ha hirdetni szeretnénk ,
	kwic_new: Ha hirdetni szeretnénk ,
Original sent: Lehet , hogy tévedek , lehet , hogy igazságtalan vagyok , de én azt gondolom , hogy akik a méreteikkel hencegnek vagy mások méretein gúnyolódnak , azok tudatosan , vagy tudat alatt , valamelyik hiányosságukról , kisebbségi érzésükrõl szeretnék elterelni a figyelmet .
	kwic: érzésükrõl szeretnék elterelni a figyelmet
	kwic_new: hiányosságukról kisebbségi érzésükrõl szeretnék elterelni a figyelmet
Original sent: A hatóságok fõleg azt szeretnék tudni , köze van -e egy 13 éves diáklány 2002-ben , fényes nappal történt elrablásához ; a lány holttestét fél év múltán találták meg egy erdõben .
	kwic: azt szeretnék tudni , köze
	kwic_new: hatóságok fõleg azt szeretnék tudni , köze van
Original sent: A Fidesz sajtóosztályán lapunknak azt mondták , nem minõsítik az ügyet , Hende pedig kijelentette , MSZP-s képviselõtársa szavait nem szeretné kommentálni .
	kwic: nem szeretné kommentálni
	kwic_new: szavait nem szeretné kommentálni
Original sent: Vagy nincsenek tisztában azzal , hogy hányadszor módosítják az alig kilenc hónapja hatályos alkotmányt , vagy csak egyszerre szeretnének elfogadni két alaptörvény-módosítást a kormánypártok .
	kwic: egyszerre szeretnének elfogadni két alaptörvény-módosítást
	kwic_new: csak egyszerre szeretnének elfogadni két alaptörvény-módosítást kormánypártok
Original sent: A szeretetszolgálat felügyelõ-bizottságának elnöke elmondta : a gyûjtéstõl függõen , minél hamarabb , már három-négy héten belül szeretnék megnyitni az irodát .
	kwic: belül szeretnék megnyitni az irodát
	kwic_new: hamarabb , már héten belül szeretnék megnyitni az irodát
Original sent: A kereskedõk szövetsége azt szeretné elérni , hogy a jogszabályban szereplõ 8 napos határidõt hosszabítsa meg a kormány - hangsúlyozta a szakmai szervezet fõtitkára .
	kwic: azt szeretné elérni , hogy
	kwic_new: szövetsége azt szeretné elérni , hogy hosszabítsa
Original sent: A nõk azt szeretnék elérni , hogy a 12 ezer embernek munkát adó segélyprogram kerüljön bele a 2011-es költségvetésbe is , amelyrõl épp most folyik a vita a kongresszusban .
	kwic: azt szeretnék elérni , hogy
	kwic_new: nõk azt szeretnék elérni , hogy kerüljön
Original sent: Állandóan szeretett volna visszakerülni Pestre íróbarátai körébe .
	kwic: szeretett volna visszakerülni Pestre íróbarátai
	kwic_new: Állandóan szeretett volna visszakerülni Pestre íróbarátai körébe
Original sent: Ugyanakkor nem is hangulatokat szeretne elkapni , hanem Krúdy világát , sõt : a világot .
