	kwic: hangulatokat szeretne elkapni , hanem
	kwic_new: Ugyanakkor nem is hangulatokat szeretne elkapni , hanem világát
Original sent: Fabrizio Miccoli , az olasz Palermo labdarúgója személyesen szeretné visszaadni Diego Maradonának , az argentin válogatott szövetségi kapitányának fülbevalóját , amelyet februárban egy aukción vásárolt meg 25 ezer euróért .
	kwic: személyesen szeretné visszaadni Diego Maradonának
	kwic_new: Miccoli személyesen szeretné visszaadni Diego Maradonának , kapitányának fülbevalóját , vásárolt
Original sent: Még színészi feladatokat is vállaltam , Siposhegyi Péter Kikötõ címû darabjában vagy egy másik kamara elõadásban Edith Piaf szerepét alakítottam , mégis , minduntalan azzal szembesültem , hogy engem a zenekar elõtt szeret látni a közönség .
	kwic: elõtt szeret látni a közönség
	kwic_new: engem zenekar elõtt szeret látni a közönség
Original sent: Nem nehéz kitalálni , hogy Orbán Viktor miféle ellenzéket szeretne függelékként csatolni kedvelt NER-jéhez : egy elpozsgaysodott " nemzeti baloldalt " , amely jó esetben elkötelezi magát a készülõ új alkotmány eszmei alapját képezõ ideológiai tézisek mellett , de legalábbis meghunyászkodva elfogadja azokat .
	kwic: szeretne függelékként csatolni kedvelt NER-jéhez
	kwic_new: Viktor ellenzéket szeretne függelékként csatolni kedvelt NER-jéhez : baloldalt , elkötelezi
Original sent: Két dologban feltétlenül szeretnék hinni .
	kwic: feltétlenül szeretnék hinni
	kwic_new: dologban feltétlenül szeretnék hinni
Original sent: Szeretném megkérdezni , hogy ha GYES mellett megyek vissza dolgozni , védettséget élvezek -e a felmondással szemben ?
	kwic: Szeretném megkérdezni , hogy
	kwic_new: Szeretném megkérdezni , hogy élvezek
Original sent: Jegyezzük fel kérdéseinket , amit szeretnénk feltenni a cég képviselõjének és már indulhatunk is a börzére .
	kwic: amit szeretnénk feltenni a cég
	kwic_new: amit szeretnénk feltenni a cég képviselõjének
Original sent: Czomba Sándor A 2011. január elsején induló Nemzeti Közfoglalkoztatási Programba a rendelkezésre állási támogatás helyett bevezetendõ bérpótló juttatásra jogosult 270 000 személybõl körülbelül 200 ezret szeretne bevonni a kormány - mondta Czomba Sándor , a Nemzetgazdasági Minisztérium foglalkoztatáspolitikai államtitkára .
	kwic: ezret szeretne bevonni a kormány
	kwic_new: Sándor személybõl körülbelül 200 ezret szeretne bevonni a kormány
Original sent: Egy olyan nyereményjátékra szeretnénk felhívni a figyelmét , amelyben akár egyetlen forint elköltése nélkül egy vadonatúj Ford Focust , vagy egyéb értékes ajándékokat nyerhet !
	kwic: nyereményjátékra szeretnénk felhívni a figyelmét
	kwic_new: Egy olyan nyereményjátékra szeretnénk felhívni a figyelmét , nyerhet
Original sent: A vállalat még az idén szeretné bemutatni a típust a világ több pontján , Európában és az Egyesült Államokban is .
	kwic: idén szeretné bemutatni a típust
	kwic_new: vállalat még az idén szeretné bemutatni a típust pontján
Original sent: Szerencsések vagyunk , ha fiatalkorunkban bármit odaadtunk volna egy Zsiguliért , ha ámulva néztük a hotelek elõtt a nyugati rendszámos Mercedeseket , BMW-ket , ha az egykori családi Trabantban , Wartburgban átélt élményeket szeretnénk felidézni egy hasonló darab birtoklásával .
	kwic: élményeket szeretnénk felidézni egy hasonló
	kwic_new: Trabantban átélt élményeket szeretnénk felidézni egy hasonló birtoklásával
Original sent: A Citroënen a hetvenes évek második felére kezdtek elhatalmasodni a pénzügyi gondok , ezért Jugoszlávia mellett szerettek volna betörni a KGST piacaira is .
	kwic: szerettek volna betörni a KGST
	kwic_new: mellett szerettek volna betörni a KGST piacaira
Original sent: Természetesen a Porsche esetében még a sportosságot is lehet fokozni némi pluszpénzért : akik idõnként versenypályára is szeretnének menni , azoknak feltétlenül meg kell majd rendelniük a Sport Chrono nevû csomagot , ezzel ugyanis szó szerint megtáltosodik a 911-es .
	kwic: is szeretnének menni , azoknak
	kwic_new: akik idõnként versenypályára is szeretnének menni , azoknak
Original sent: Aki nem csak helyváltoztatásra , hanem egy kis mókázásra is be szeretné vetni az Ibizáját , minimum az FR felszereltségi szintet kell kipipálnia a rendelésnél , mert ekkor a kormányszervó rásegítse se olyan érzéketlen , mint egy játéktermi szimulátorban , hanem érezhetõ ellenállása van a tekergetésnek .
	kwic: be szeretné vetni az Ibizáját
	kwic_new: Aki helyváltoztatásra be szeretné vetni az Ibizáját ,
Original sent: A második azoknak , akiknek kevesebb az idejük , leginkább délután vagy este érnek rá , és egyszerûbb módon , élelmiszerüzletben , büfékben kapható alapanyagokból , ételekbõl szeretnék összeállítani étrendjüket .
	kwic: ételekbõl szeretnék összeállítani étrendjüket
	kwic_new: alapanyagokból ételekbõl szeretnék összeállítani étrendjüket
Original sent: Szeretnénk tehát megtudni , mit gondol .
	kwic: Szeretnénk tehát megtudni , mit
	kwic_new: Szeretnénk tehát megtudni , mit gondol
Original sent: Falkában szeret éldegélni , ezért olyan helyen ideális a tartása , ahol lehet venni kell mellé egy másik kutyát .
	kwic: Falkában szeret éldegélni , ezért
	kwic_new: Falkában szeret éldegélni , ezért kell
Original sent: Azoknak ajánljuk , akik napi rendszerességgel interneteznek és a szupergyors szélessávú internet-hozzáférés elõnyeit szeretnék élvezni .
	kwic: elõnyeit szeretnék élvezni
	kwic_new: szélessávú internet-hozzáférés elõnyeit szeretnék élvezni
Original sent: " Szeretnék köszönetet mondani a világ legjobb autógyártó cégének az elmúlt 22 évért , amelyek során egy pillanatra sem veszítettem el a szenvedélyemet " - nyilatkozta a 60 éves Haug .
	kwic: Szeretnék köszönetet mondani a világ
	kwic_new: " Szeretnék köszönetet mondani a világ cégének évért
Original sent: Sokan azt hiszik , hogy a színészek szeretik látni magukat a vásznon , pedig ez nem igaz .
	kwic: színészek szeretik látni magukat a
	kwic_new: a színészek szeretik látni magukat a vásznon , pedig
Original sent: Az viszont elõfordul , hogy a segélykérõ újra telefonál , mert ismét beszélni szeretne a problémájáról , vagy elújságolja , hogy megoldódtak a gondjai .
	kwic: mert ismét beszélni szeretne a
	kwic_new: mert ismét beszélni szeretne a problémájáról , vagy
Original sent: Az [ origo ] július 30-án fordult a testülethez azzal , hogy szeretnénk megismerni a felügyelõbizottság az ülésrõl készült jegyzõkönyvet , mivel a BKV közfeladatot lát el , ezért a tevékenységérõl szóló adatok nyilvánosak .
	kwic: hogy szeretnénk megismerni a felügyelõbizottság
	kwic_new: hogy szeretnénk megismerni a felügyelõbizottság jegyzõkönyvet , mivel
Original sent: A tilalomról , illetve a köztéri alkoholfogyasztás szabályairól korábban a kerületi önkormányzatok dönthettek , Tarlós István azonban szeretné elérni , hogy a rendelet egységesen , az összes fõvárosi aluljáróra vonatkozzon .
	kwic: azonban szeretné elérni , hogy
	kwic_new: István azonban szeretné elérni , hogy vonatkozzon
Original sent: A legnagyobb kommunistázás : A jobbikos Staudt Gábor a nemzeti fejlesztési minisztertõl azt szeretné megtudni : " Hogyan lehet , hogy a vörös gyilkosokat dicsõítik , a magyar közéleti nagyjaink sírjait pedig elbontani készülnek a Fiumei Sírkertben ? "
	kwic: azt szeretné megtudni : "
	kwic_new: kommunistázás azt szeretné megtudni : " lehet
Original sent: Mûvészetet szeretnék látni " .
	kwic: Mûvészetet szeretnék látni "
	kwic_new: Mûvészetet szeretnék látni "
Original sent: Washington Csehországban és Lengyelországban szeretné kiépíteni az elvileg a Közel-Kelet irányát védeni hivatott rendszer egyes részeit , de Moszkva már azzal kapcsolatban is jelezte , hogy helyteleníti a tervet .
	kwic: Lengyelországban szeretné kiépíteni az elvileg
	kwic_new: Washington Lengyelországban szeretné kiépíteni az elvileg részeit , de
Original sent: Szõdy Judit válaszol Ha problémáid adódnak a gyermeknevelésben , kérdéseidre senki nem ad igazán használható választ , és valóban arról szeretnél olvasni , ami igazán érdekel , írj nekünk .
	kwic: arról szeretnél olvasni , ami
	kwic_new: valóban arról szeretnél olvasni , ami érdekel
Original sent: Nicole Kidman idegesíteni szeretné volt férjét Valóban eljegyezték Nicole Kidmant Nicole Kidman boldogságot kíván Cruise-nak Nicole Kidman különleges születésnapja Nicole Kidman szakított filmproducer barátjával
	kwic: Nicole Kidman idegesíteni szeretné volt
	kwic_new: Nicole Kidman idegesíteni szeretné volt férjét eljegyezték barátjával
Original sent: Nagyon szeretnél többet törõdni a párkapcsolatoddal , minden erõddel azon vagy , hogy erre idõt szakíts .
	kwic: szeretnél többet törõdni a párkapcsolatoddal
	kwic_new: Nagyon szeretnél többet törõdni a párkapcsolatoddal , azon , hogy
Original sent: Anderson - a PETA állatvédõ szervezet elkötelezett aktivistája - azt írta , szeretné " kihasználni " az állampolgárság nyújtotta jogokat , és fel kívánja hívni a politikusok figyelmét az állatokkal való kegyetlen bánásmódra .
	kwic: szeretné " kihasználni " az
	kwic_new: szeretné " kihasználni " az
Original sent: Az egyik bulin csak egy lemezjátszó várt , de cédérõl nem szeretek játszani .
	kwic: nem szeretek játszani
	kwic_new: cédérõl nem szeretek játszani
Original sent: Akik viszont szeretnének inkább elszakadni a mai világtól , azoknak a városközpont ígér majdhogynem valódi idõutazást , hiszen teljes egészében megõrizte reneszánsz jellegét : ide keveredve vöröses épületek között , illetve roppant mód tágas tereken vagy fedett sétányokon találhatjuk magunkat .
	kwic: szeretnének inkább elszakadni a mai
	kwic_new: Akik viszont szeretnének inkább elszakadni a mai világtól ,
Original sent: És végül : " Megkérdezték tolem , hogy szeretnék -e tovább élni az emberek emlékezetében , de én tulajdonképpen a saját nappalimban szeretnék tovább élni . "
	kwic: szeretnék tovább élni .
	kwic_new: én tulajdonképpen nappalimban szeretnék tovább élni .
Original sent: - Nem szeretnék részletekrõl beszélni , mivel ez a klubra és rám tartozik .
	kwic: szeretnék részletekrõl beszélni , mivel
	kwic_new: Nem szeretnék részletekrõl beszélni , mivel tartozik
Original sent: Úgy látszik , a fiataloknak már az is elég , ha van lakásuk , remek autóval közlekedhetnek , akad olyan , aki Berlin fõterén szeret villogni a kabriójával , vagyis magyar futballistaként Dárdai Palival azt kellett megélnünk a Bundesligában , hogy profibbak vagyunk jó néhány itteni játékosnál , persze mindez nem az idõsebbekre vonatkozik , hanem fõként a fiatalabbakra .
	kwic: fõterén szeret villogni a kabriójával
	kwic_new: aki Berlin fõterén szeret villogni a kabriójával , vagyis
Original sent: S a szüleimnek is szerettem volna bebizonyítani , hogy azokat a serlegeket , amiket külföldrõl hoztam , nem a boltban vettem !
	kwic: szerettem volna bebizonyítani , hogy
	kwic_new: S szüleimnek szerettem volna bebizonyítani , hogy vettem
Original sent: Torino 2006 Amit tudni szeretne a XX. téli olimpiáról , itt biztosan megtalálja !
	kwic: 2006 Amit tudni szeretne a
	kwic_new: Torino 2006 Amit tudni szeretne a olimpiáról , megtalálja
Original sent: UEFA-kupa 2006-2007 - Út a döntõig Nem kapott licencet az FTC és a Vác Csank János a Diósgyõr új edzõje Sportvideók Ha nem csak olvasni , hanem nézni is szereti .
	kwic: , hanem nézni is szereti
	kwic_new: olvasni , hanem nézni is szereti
Original sent: Sportvideók Ha nem csak olvasni , hanem nézni is szereti .
	kwic: , hanem nézni is szereti
	kwic_new: Sportvideók Ha , hanem nézni is szereti
Original sent: A vb-n a két felsõ súlycsoportot kivéve minden kategóriában ( 48 , 51 , 54 , 57 , 60 , 64 , 69 , 75 , 81 ) az elsõ nyolc szerez olimpiai kvótát , a 91 és a plusz 91 kilósok között azonban a négy közé kell jutnia annak , aki már Chicagóban biztosítani szeretné pekingi helyét .
	kwic: már Chicagóban biztosítani szeretné pekingi
	kwic_new: aki már Chicagóban biztosítani szeretné pekingi helyét
Original sent: A FIFA-elnök a 6 plusz 5-ös szabályt szeretné bevezetni az európai kluboknál , ami azt jelenti , hogy legalább hat hazai játékosnak kell szerepelnie a kezdõcsapatban .
	kwic: szabályt szeretné bevezetni az európai
	kwic_new: FIFA-elnök a plusz 5-ös szabályt szeretné bevezetni az európai kluboknál , jelenti
Original sent: Meg kell találni az összhangot , a jövõben szeretnék pragmatikusabban játszani , fokozottan ellenfélre készülni .
	kwic: szeretnék pragmatikusabban játszani , fokozottan
	kwic_new: jövõben szeretnék pragmatikusabban játszani , fokozottan készülni
Original sent: A találkozó mindkét gárdának nagy jelentõséggel bír : a firenzeiek a BL-indulást érõ negyedik hely megtartásáért küzdenek , míg az Inter szeretné megõrizni hétpontos elõnyét a Juventus elõtt .
	kwic: Inter szeretné megõrizni hétpontos elõnyét
	kwic_new: míg az Inter szeretné megõrizni hétpontos elõnyét
Original sent: A lejáró szerzõdésû játékost fõként anyagi nézetkülönbségek miatt engedte el a Chelsea : heti 80 ezer fontos fizetését ötven százalékkal szerette volna feltornázni , amire a klubvezetés nemet mondott , és nem is tett elé újabb ajánlatot .
	kwic: szerette volna feltornázni , amire
	kwic_new: fizetését százalékkal szerette volna feltornázni , amire mondott
Original sent: Cúlio szeret Rómában játszani
	kwic: szeret Rómában
	kwic_new: Cúlio szeret Rómában játszani
Original sent: Én középhátvéd szeretek lenni , nagyon kényelmesen érzem magam a pálya azon részén .
	kwic: középhátvéd szeretek lenni , nagyon
	kwic_new: Én középhátvéd szeretek lenni , nagyon érzem
Original sent: Bár marasztalták , novemberben bejelentette , hogy távozik , de hangsúlyozta , hogy még nem szeretné abbahagyni a labdarúgást .
	kwic: nem szeretné abbahagyni a labdarúgást
	kwic_new: még nem szeretné abbahagyni a labdarúgást
Original sent: A L'Équipe címû francia lap szerint a PSG férfikézilabda-csapata szeretné megszerezni a Veszprém klasszisát , Nagy Lászlót .
	kwic: férfikézilabda-csapata szeretné megszerezni a Veszprém
	kwic_new: szerint PSG férfikézilabda-csapata szeretné megszerezni a Veszprém klasszisát
Original sent: A vezeték nélküli technológiák közül a 901-es a wifit és a Bluetootht támogatja , ha mobilinternetet szeretne vele használni a tulajdonos , az kizárólag USB-s modemmel lehetséges .
	kwic: szeretne vele használni a tulajdonos
	kwic_new: mobilinternetet szeretne vele használni a tulajdonos , lehetséges
Original sent: Hamarosan azonban a rutinfeladat teljesen új irányt vesz , kiderül ugyanis , hogy a filmstúdió fõnöke ezentúl a sztárjaival musicaleket , és családi filmeket szeretne forgatni .
	kwic: filmeket szeretne forgatni
	kwic_new: fõnöke ezentúl musicaleket családi filmeket szeretne forgatni
Original sent: A legtöbb quantified self-hívõ valami határozott céllal naplózza magát : fejlõdni szeretnének , betegek , optimalizálni akarják az idejüket , esetleg a sport vagy a meditáció hatásait akarják felmérni - mondta az [ origo ] -nak Regényi Ádám , a Budapest QS csoport szervezõje .
	kwic: magát : fejlõdni szeretnének ,
	kwic_new: magát : fejlõdni szeretnének , akarják
Original sent: Ezen a helyzeten nagy erõkkel szeretne változtatni a Google , amely jövõre megjelenteti szuahéli nyelven is a hangvezérléses Androidot - mondta korábban az [ origo ] -nak Pedro Moreno , a keresõóriás hangvezérlését fejlesztõ csapat vezetõje .
	kwic: erõkkel szeretne változtatni a Google
	kwic_new: helyzeten nagy erõkkel szeretne változtatni a Google , megjelenteti
Original sent: " Szeretném visszakapni a munkámat .
	kwic: " Szeretném visszakapni a munkámat
	kwic_new: " Szeretném visszakapni a munkámat
Original sent: Ha kicsit kevesebbet szeretnének költeni , érdemes a Vercelli Avenuet , vagy a Buenos Aires Avenuet választani .
	kwic: kevesebbet szeretnének költeni , érdemes
	kwic_new: kicsit kevesebbet szeretnének költeni , érdemes
Original sent: A park közepén lévõ szökõkutat megõrzik , sõt a két oldalsó szökõkutat is szeretnék mûködõképessé tenni .
	kwic: szeretnék mûködõképessé tenni
	kwic_new: szökõkutat is szeretnék mûködõképessé tenni
Original sent: Az interjúban Járai elismeri : a döntés rosszkor született , mert bejelentése pillanatában a forint már gyengébb volt , mint amit a jegybank és a kabinet látni szeretett volna , a piac ráadásul túlreagált a sáveltolást .
	kwic: a kabinet látni szeretett volna
	kwic_new: amit jegybank a kabinet látni szeretett volna , túlreagált sáveltolást
Original sent: 100 töltõállomással törnek be az OMV területére Tovább izmozik az OMV a Mol megszerzésén Marad a Mol-vezetés az OMV-vezér szerint Stagnált az OMV olajkitermelése Együtt fejlesztene OMV és a Gazprom Az OMV nem adja fel Hernádi : nem alaptalanul aggódik a Mol Hernádi Zsolt , a Mol elnök-vezérigazgatója az osztrák folyóirat hétfõi számában megjelenõ , de a hét végén már elõzetesen ismertetett interjúban azt mondta , hogy olyan kínálatot szeretnének nyújtani , amely elnyeri a vásárlók tetszését .
	kwic: kínálatot szeretnének nyújtani , amely
	kwic_new: olyan kínálatot szeretnének nyújtani , amely elnyeri
Original sent: Ha igen , milyen elveket szeretne látni érvényesülni ? ( jOvO )
	kwic: szeretne látni érvényesülni ? (
	kwic_new: Ha elveket szeretne látni érvényesülni ? ( jOvO
Original sent: Miért nem akartál védett lenni ? ( mercee ) - Egyenrangúvá szerettem volna válni a többiekkel , ez sikerült is .
	kwic: szerettem volna válni a többiekkel
	kwic_new: Egyenrangúvá szerettem volna válni a többiekkel , sikerült
Original sent: Karrier vagy család ? ( tundermacika ) - A modellkedést még két-három évig szeretném csinálni - amíg a külsõm megengedi .
	kwic: évig szeretném csinálni - amíg
	kwic_new: modellkedést két-három évig szeretném csinálni - amíg
Original sent: A T-Mobile világszinten tervez valami , esetleg a versenytárséhoz hasonló lépést ? ( evbalazs ) - Igen , tudunk róla , hogy az unió szabályozni szeretné ezt a kérdést .
	kwic: az unió szabályozni szeretné ezt
	kwic_new: az unió szabályozni szeretné ezt kérdést
Original sent: Ugyanakkor az Indianapolis Motor Speedaway tulajdonosa , Tony George úgy nyilatkozott , hogy a hamarosan lejáró F1-es szerzõdést mindenképpen szeretné meghosszabbítani .
	kwic: mindenképpen szeretné meghosszabbítani
	kwic_new: szerzõdést mindenképpen szeretné meghosszabbítani
Original sent: A Swype részben a hagyományos mobilokról ismert T9 elvén mûködik : kitalálja , hogy az adott " gombnyomás-sorozattal " mit is szerettünk volna elérni .
	kwic: szerettünk volna elérni
	kwic_new: gombnyomás-sorozattal mit szerettünk volna elérni
Original sent: Aki Hódmezõvásárhelyre szeretne eljutni , az szintén a Szentesi úton haladva tud kimenni az elkerülõre .
	kwic: Hódmezõvásárhelyre szeretne eljutni , az
	kwic_new: Aki Hódmezõvásárhelyre szeretne eljutni , az
Original sent: Tapasztalataink szerint az a legjobb pályaválasztás , amikor a gyerek megfogja , megszagolja azt a tevékenységet , amirõl úgy gondolja , hogy azzal szeretne majd foglalkozni tette hozzá az igazgató .
	kwic: szeretne majd foglalkozni tette hozzá
	kwic_new: azzal szeretne majd foglalkozni tette hozzá igazgató
Original sent: Ennek ellenére a pápa és Imre viszonya nem volt felhõtlen , mivel mindketten ki szerették volna terjeszteni befolyásukat Bulgáriára , illetve III. Ince pápa szorgalmazta a keresztes hadjárat megindítását , s a magyar részvételt ebben .
	kwic: szerették volna terjeszteni befolyásukat Bulgáriára
	kwic_new: mindketten ki szerették volna terjeszteni befolyásukat Bulgáriára , illetve
Original sent: A Manchester United inkább a Barcelonának szerette volna eladni Beckhamet , de õ mégis a Real Madridhoz írt alá .
	kwic: szerette volna eladni Beckhamet ,
	kwic_new: United inkább Barcelonának szerette volna eladni Beckhamet , de
Original sent: Társaságban elbûvölõ , szereti vendégül látni barátait , új emberekkel ismerkedni .
	kwic: szereti vendégül látni barátait ,
	kwic_new: szereti vendégül látni barátait , ismerkedni
Original sent: Azok , akik élvezték , szeretnék látni a Shahkrit Yamnarm által játszott Kongot egy folytatásban .
	kwic: , szeretnék látni a Shahkrit
	kwic_new: , szeretnék látni a Shahkrit
Original sent: Egy fiatal cserkészfiú kopogtat az ajtaján és felajánlja segítségét , mert szeretné megszerezni azt a kitûzõt , amit a segítség ellenében megkapna .
	kwic: mert szeretné megszerezni azt a
	kwic_new: mert szeretné megszerezni azt a kitûzõt , megkapna
Original sent: A lehetõ leghitelesebben szerette volna elkészíteni a filmet és " beültetni a nézõt a Humvee-ba , mintha õ is egy katona lenne a bevetésen " .
	kwic: szerette volna elkészíteni a filmet
	kwic_new: lehetõ leghitelesebben szerette volna elkészíteni a filmet és , mintha
Original sent: Az iskolák meghosszabbítják a gyerekkort és legitimálják azt , ha a diák még nem szeretne beilleszkedni a " felnõttek világába " .
	kwic: nem szeretne beilleszkedni a "
	kwic_new: diák még nem szeretne beilleszkedni a " világába
Original sent: A film elején Greg Beckur ( Ben Stiller ) Chicagóból felhívja telefonon a szüleit , akik Miamiban élnek , ám csak az üzenetrögzítõ kapcsol be : Greg elmondja , hogy szeretne beszélni velük , mielõtt a menyasszonyával Pammel és annak szüleivel meglátogatnák õket egy hétvégére .
	kwic: hogy szeretne beszélni velük ,
	kwic_new: hogy szeretne beszélni velük , mielõtt
Original sent: A fõhõs jelenti barátjának , A.-nak , hogy szeretne közéjük tartozni .
	kwic: szeretne közéjük tartozni
	kwic_new: szeretne közéjük tartozni
Original sent: A Cartoon Network egy gerillamarketinges fogással szerette volna reklámozni az Adult Swimen futó Aqua Teen Hunger Force címû rajzfilmsorozatot , oly módon , hogy a város különbözõ pontjain a sorozat egyik figuráját ábrázoló , villogó szerkezeteket helyeztek el .
	kwic: szerette volna reklámozni az Adult
	kwic_new: Network fogással szerette volna reklámozni az Adult rajzfilmsorozatot , hogy
Original sent: Egyébként ezzel a döntéssel , ezzel a gyûlölködéssel nem értenek egyet a budapestiek - ezt csak érdekességképpen szeretném megosztani a hallgatókkal .
	kwic: érdekességképpen szeretném megosztani a hallgatókkal
	kwic_new: ezt csak érdekességképpen szeretném megosztani a hallgatókkal
Original sent: Stefano Favarro : - Amikor erre van lehetõséged , mi nagyon szívesen rendelkezésre állunk , mindenképpen , hogy zárásként szeretném mondani , hogy máris írtam az én közleményet , hogy mindenképpen rendelkezésre állunk egy tárgyalásra a Magyar Sportújságírók Szövetséget és mindenképpen szeretném tisztázni , de egy dolog , egy dolog nem fogunk változtatni rajta , a rendszer ugyanilyen fog maradni , amikor a Gábor ráér és itthon van , akkor lehetne vele beszélni .
	kwic: mindenképpen szeretném tisztázni , de
	kwic_new: Szövetséget mindenképpen szeretném tisztázni , de fogunk
Original sent: Petõ Attila : - Azért ismerte fel a hölgy , ezeket a dolgokat , mert ezt a vizsgán be kell mutatnia , tehát a vizsgán vannak kötelezõ ellenõrzési feladatok , egy kicsit szeretném megvédeni a szakmát , elhangzott , hogy a hivatalos könyv nem említ bizonyos dolgokat , vagy sok olyan dologról nem beszél , ami elmaradott , hát azért tudni kell , hogy ma nemcsak hivatalos könyvekbõl tanulunk , tehát vannak nagyon jó szakirányú tankönyvek , illetve hát egy magára valamit adó elméleti oktató , megemlíti azért ezt az elméleti oktatás során , amirõl itt a kollega is beszélt az ABS-tõl kezdve , mert aztán olyan helyzet is lehet , én is hoztam egy ilyen bakit , hogy telefonált a szervizbe a kollegina , hogy valami baj van az autóval , mert fékezés
	kwic: kicsit szeretném megvédeni a szakmát
	kwic_new: Attila , vannak egy kicsit szeretném megvédeni a szakmát , elhangzott
Original sent: Nem nagy dolgok ezek , csak hogy hagyjanak már dolgozni minket , szeretnénk megélni normálisan , szeretnénk egymásnak örömet okozni .
	kwic: , szeretnénk megélni normálisan ,
	kwic_new: dolgok , hogy dolgozni , szeretnénk megélni normálisan , szeretnénk
Original sent: Keresztes Ilona . : - Biztos , hogy nem úgy lehet ezt elképzelni , hogyha valaki úgy érzi , hogy van egy üres éve , vagy szeretnék kiheverni a szülei által okozott nevelést , akkor ide menekülhet , mint egy ilyen menedékházba , hanem itt mégiscsak a fiatalok élete zajlik , és õk nem kísérleti terep .
	kwic: vagy szeretnék kiheverni a szülei
	kwic_new: vagy szeretnék kiheverni a szülei nevelést , menekülhet
